--
-- PostgreSQL database dump
--

-- Dumped from database version 14.5
-- Dumped by pg_dump version 14.5

SET statement_timeout = 0;
SET lock_timeout = 0;
SET idle_in_transaction_session_timeout = 0;
SET client_encoding = 'UTF8';
SET standard_conforming_strings = on;
SELECT pg_catalog.set_config('search_path', '', false);
SET check_function_bodies = false;
SET xmloption = content;
SET client_min_messages = warning;
SET row_security = off;

SET default_tablespace = '';

SET default_table_access_method = heap;

--
-- Name: alembic_version; Type: TABLE; Schema: public; Owner: postgres
--

CREATE TABLE public.alembic_version (
    version_num character varying(32) NOT NULL
);


ALTER TABLE public.alembic_version OWNER TO postgres;

--
-- Name: listings; Type: TABLE; Schema: public; Owner: postgres
--

CREATE TABLE public.listings (
    data_listing_id bigint NOT NULL,
    img_url character varying,
    title character varying,
    date_posted_str character varying,
    date_posted_date date,
    location character varying,
    bedrooms character varying,
    description character varying,
    price character varying,
    currency character varying
);


ALTER TABLE public.listings OWNER TO postgres;

--
-- Name: listings_data_listing_id_seq; Type: SEQUENCE; Schema: public; Owner: postgres
--

CREATE SEQUENCE public.listings_data_listing_id_seq
    START WITH 1
    INCREMENT BY 1
    NO MINVALUE
    NO MAXVALUE
    CACHE 1;


ALTER TABLE public.listings_data_listing_id_seq OWNER TO postgres;

--
-- Name: listings_data_listing_id_seq; Type: SEQUENCE OWNED BY; Schema: public; Owner: postgres
--

ALTER SEQUENCE public.listings_data_listing_id_seq OWNED BY public.listings.data_listing_id;


--
-- Name: listings data_listing_id; Type: DEFAULT; Schema: public; Owner: postgres
--

ALTER TABLE ONLY public.listings ALTER COLUMN data_listing_id SET DEFAULT nextval('public.listings_data_listing_id_seq'::regclass);


--
-- Data for Name: alembic_version; Type: TABLE DATA; Schema: public; Owner: postgres
--

COPY public.alembic_version (version_num) FROM stdin;
a51d104f0790
\.


--
-- Data for Name: listings; Type: TABLE DATA; Schema: public; Owner: postgres
--

COPY public.listings (data_listing_id, img_url, title, date_posted_str, date_posted_date, location, bedrooms, description, price, currency) FROM stdin;
1625244407	https://media.kijiji.ca/api/v1/ca-prod-dealer-ads/images/23/23ffbdbc-8799-4908-bbd9-7e731e733937?rule=kijijica-200-jpg	Beautiful Bachelor Apartment Available Downtown Toronto!	13-08-2022	2022-08-13	City of Toronto	Beds: Bachelor/Studio	This building has a truly spectacular view! Large balconies with stunning views of the Toronto skyline. Perfect for entertaining. Most units have stainless steel appliances incl. over the range ... 2 storey one bedroom 2 large balconies stunning views of the Toronto TTC Transit close by newly constructed Perfect for entertaining All new stainless steel appliances incl. over the range dishwasher Stunning open riser staircase hardwood Downtown	1,550.00	$
1619544697	https://media.kijiji.ca/api/v1/ca-prod-dealer-ads/images/32/322c439d-bf22-43c9-ae4c-763ac95fca50?rule=kijijica-200-jpg	Buy with ZERO or 5% Down or Rent To Own Program	30-08-2022	2022-08-30	City of Toronto	Beds: 4	****Buy Any house with Zero Down or Rent-To-Own Program or 5% or 10% down payment based on your qualifications For Buyers -Buy House with Zero Down Payment Program* (Different program than ...	Please Contact	No currency provided
1631150883	https://media.kijiji.ca/api/v1/ca-prod-dealer-ads/images/e0/e00b14fd-1d16-4b2c-b8d8-a2788e59e381?rule=kijijica-200-jpg	PROMO! Bachelor -Save $1,500-$2,000! - MOST POPULAR STYLE	31-08-2022	2022-08-31	City of Toronto	Beds: Bachelor/Studio	Hurry! Limited Time offer. Move-in on or before October 1st and get 1-month free rent for October on Select suites Hurry! Limited Time offer. Move-in on or before October 1st and get 1-month free ... FLASH SALE | Incredible Incentives, Virtual Tours &amp; Incredible Suites! Call Today!	1,829.00	$
1631944736	https://media.kijiji.ca/api/v1/ca-prod-dealer-ads/images/54/54e22a32-2d38-4729-ba70-1256812f5795?rule=kijijica-200-jpg	Upgraded One-bedroom, DVP & Eglinton Ave East - ID 2341	06-09-2022	2022-09-06	City of Toronto	Beds: 1	Akelius one bedroom apartment for rent. Eglinton Avenue East and DVP in the North York neighborhood, Toronto. one bedroom suite - 1 bathroom - located on floor 3 - approximately 671 square feet - ...	1,750.00	$
1632115603	https://media.kijiji.ca/api/v1/ca-prod-fsbo-ads/images/47/47b3e3d3-78c7-4b5b-b7d6-64ce08390c4b?rule=kijijica-200-jpg	3 Bedroom Townhouse for Rent - All Utilities Included! Pool/Gym	07-09-2022	2022-09-07	City of Toronto	Beds: 3	2 floor - 3 bedroom, 2 washroom townhouse in a condominium building. Building has pool, gym and sauna. Close to Seneca College Newnham Campus, DVP & Arbor Glen Public School. Available immediately. ...	3,200.00	$
1631223419	https://media.kijiji.ca/api/v1/ca-prod-dealer-ads/images/54/5445449f-e14c-4187-9d64-c30aa3a45f8f?rule=kijijica-200-jpg	2 Bedroom Apartments for Rent on Jackes Avenue	11-09-2022	2022-09-11	Toronto	Beds: 2	Join Us for Our In-person Open House Every Wednesday and Friday from 4pm to 6pm By appointment only. Call Now to Reserve Your Spot! The Summerhilll at 7 Jackes Avenue is an amazing luxury residence ... Ask About our Rental Incentive!	3,384.00	$
1631223390	https://media.kijiji.ca/api/v1/ca-prod-dealer-ads/images/60/6066cf10-7cfd-466f-a3aa-32927ef332c4?rule=kijijica-200-jpg	3 Bedroom  Pent House Apartment for Rent on Jackes Avenue	11-09-2022	2022-09-11	Toronto	Beds: 3	Join Us for Our In-person Open House Every Wednesday and Friday from 4pm to 6pm By appointment only. Call Now to Reserve Your Spot! The Summerhilll at 7 Jackes Avenue is an amazing luxury residence ... Ask About our Rental Incentive!	8,995.00	$
1631223376	https://media.kijiji.ca/api/v1/ca-prod-dealer-ads/images/a0/a09352ae-b20e-4c82-8b05-9629a54bdd00?rule=kijijica-200-jpg	Jr 1 Bedroom Apartments for Rent on Jackes Avenue	11-09-2022	2022-09-11	Toronto	Beds: 1	Join Us for Our In-person Open House Every Wednesday and Friday from 4pm to 6pm By appointment only. Call Now to Reserve Your Spot! The Summerhilll at 7 Jackes Avenue is an amazing luxury residence ... Ask About our Rental Incentive!	2,050.00	$
1632630538	https://media.kijiji.ca/api/v1/ca-prod-fsbo-ads/images/13/13935566-ca20-480f-93e1-6069904e365e?rule=kijijica-200-jpg	Spacious 3 bedroom Bungalow Main Unit for rent	11-09-2022	2022-09-11	Toronto	Beds: 3	HI , We are renting our 3 bedroom house main level. Relax in comfort with our Spacious living room ,Kitchen,3 bedrooms and bathroom, a large backyard with Garden .Include Bed, Wooden rack, Can spend ...	2,550.00	$
1631152994	https://media.kijiji.ca/api/v1/ca-prod-dealer-ads/images/14/14ecd34d-8925-4330-b2b0-9c964ee67b41?rule=kijijica-200-jpg	1 Bdrm available at 77 Huntley Street, Toronto	11-09-2022	2022-09-11	Toronto	Beds: 1	Visit our Website: https://www.rpmsi.ca/property/huntley-apartments-77-huntley/ Come experience the Huntley Apartments. Featuring balconies and other upgrades, and only steps away from Sherbourne ...	2,010.00	$
1632626952	https://media.kijiji.ca/api/v1/ca-prod-fsbo-ads/images/b8/b80e81fe-fa34-4ef9-940c-da8f1355c2ca?rule=kijijica-200-jpg	Above ground 1 bedroom basement apartment	11-09-2022	2022-09-11	Toronto	Beds: 1	Clean, bright room (natural light) with separate entrance. A few steps from bus stop, in between Sheppard and Yonge subway stations. A few steps to plaza, banks, Metro, parks, schools and shops. ...	1,600.00	$
1632626865	https://media.kijiji.ca/api/v1/ca-prod-fsbo-ads/images/f8/f830069c-90c5-4f25-a395-21568004f3fb?rule=kijijica-200-jpg	Large 3 bdrm 2 Bath Penthouse unit in Chinatown(Queen &Spadina)	11-09-2022	2022-09-11	Toronto	Beds: 3 + Den	Required: -Recent Job Letter, last 3 pay stubs, Recent Equifax or TransUnion credit score and Detailed report, Copy of Drivers License *3 Bedroom plus Den and 2 Full Bathrooms *Possession Date: ...	4,300.00	$
1625040112	https://media.kijiji.ca/api/v1/ca-prod-dealer-ads/images/f5/f5cf979c-6d06-42fe-b5c7-2cf8179ee9be?rule=kijijica-200-jpg	Upscale 1 Bedroom Suite Davisville & Mt Pleasant Rd	11-09-2022	2022-09-11	City of Toronto	Beds: 1	Prime Address Davisville & Mount Pleasnant Road CALL, TEXT OR EMAIL TEXT TODAY TO BOOK A VIEWING! (416) 856-8470 These Suites are right on the Yonge subway line and are in one of the top 3 school ...	2,299.00	$
1632626611	https://media.kijiji.ca/api/v1/ca-prod-fsbo-ads/images/ea/ea4770cd-3b05-443c-800e-aa5f02e68ebd?rule=kijijica-200-jpg	All Included Main floor apartment with backyard	11-09-2022	2022-09-11	Toronto	Beds: 1	Main floor unit for lease into a triplex , comes with all utilities included, even high speed internet , 1 bed , 1 bath with large backyard space , 650 sqft... furniture showing on this ads are ...	2,500.00	$
1632625653	https://media.kijiji.ca/api/v1/ca-prod-fsbo-ads/images/ee/ee913bff-3897-4c2a-9ef3-b173c2f3b45d?rule=kijijica-200-jpg	Separate one-bedroom basement apartment	11-09-2022	2022-09-11	Vaughan	Beds: 1	FROM 1 October. One bedroom basement apartment in a highly convenient neighborhood - Fully renovated - Сomplete deep tub with shower - Stove, Microwave, little fridge - Air Conditioning - Separate ...	1,950.00	$
1632625647	https://media.kijiji.ca/api/v1/ca-prod-fsbo-ads/images/0b/0b6e0e4c-0836-464b-b9c0-009432cb666f?rule=kijijica-200-jpg	MUST SEE: Amazing Waterfront Home for rent!	11-09-2022	2022-09-11	Toronto	Beds: 5+	Experience Waterfront Living. Amazing home for rent (4 BR, 2 BA, 2 extra rooms/offices in basement, parking, garden) ONLY $4300/month (utilities not included). Short Walk To The Beach, Waterfront ...	4,300.00	$
1632624771	https://media.kijiji.ca/api/v1/ca-prod-fsbo-ads/images/b0/b0fab257-fcb7-4a81-b096-4a4a26f497a4?rule=kijijica-200-jpg	LUXURY CONDOS WITH 5 STARS AMENITIES FOR RENT	11-09-2022	2022-09-11	City of Toronto	Beds: 1	***PLEASE READ THE AD FIRST*** *PLEASE DO NOT CONTACT IF YOU DON'T HAVE THE REQUIREMENTS. *PLEASE MSG ME WITH YOUR CRITERIA.(budget, move in date, area) *NO STUDENTS PLEASE * NO SHORT TERM LEASES ...	2,300.00	$
1632624465	https://media.kijiji.ca/api/v1/ca-prod-fsbo-ads/images/e7/e795dc92-69f8-49bf-ac52-bd895bf903f6?rule=kijijica-200-jpg	LUXURY CONDOS WITH GREAT AMENITIES FOR RENT	11-09-2022	2022-09-11	City of Toronto	Beds: 1	***PLEASE READ THE AD FIRST*** *PLEASE DO NOT CONTACT IF YOU DON'T HAVE THE REQUIREMENTS. *PLEASE MSG ME WITH YOUR CRITERIA.(budget, move in date, area) *NO STUDENTS PLEASE * NO SHORT TERM LEASES ...	2,300.00	$
1632624462	https://media.kijiji.ca/api/v1/ca-prod-fsbo-ads/images/e0/e0665c15-eaf3-4325-83a2-c10ecc61668b?rule=kijijica-200-jpg	Scarborough 2 bedroom basement for rent from October 1st	11-09-2022	2022-09-11	Scarborough	Beds: 2	SCARBOROUGH BASEMENT FOR RENT: Mclevin and Glanvil crescent .Scarborough. -Separate entrance. -Specious 2 bedroom . -One full washroom . -Eat in kitchen. -Furnished. -Free WiFi. -Tenants pay 40% ...	Please Contact	No currency provided
1632623969	No photo	2 + 2 house basement , separate entrance	11-09-2022	2022-09-11	Toronto	Beds: 2	2 bedrooms (one big suite) 2 bath room basements, big and bright windows. Close to Agincourt mall. Very convenient place.	Please Contact	No currency provided
1632622845	https://media.kijiji.ca/api/v1/ca-prod-fsbo-ads/images/f3/f3dc57a3-2374-424b-a069-a02caf19fd26?rule=kijijica-200-jpg	Don Mills/Lawrnce: 1 bdrm  on 1st floor,  patio, amenitiies, pkg	11-09-2022	2022-09-11	Toronto	Beds: 1	Beautiful, bright 1 bdrm condo on main floor - large private patio. High ceilings, floor-ceiling windows, laminate floors, stainless steel appliances. Great building with gym, roof-patio, theatre. At ...	2,200.00	$
1632621517	https://media.kijiji.ca/api/v1/ca-prod-fsbo-ads/images/c9/c9972dd7-7e4a-4b57-b2bc-0ae704dd38bc?rule=kijijica-200-jpg	Beautiful One Bedroom Basement Apartment (w/ Separate Entrance)	11-09-2022	2022-09-11	Pickering	Beds: 1	Lovely and spacious one bedroom basement apartment which has never been lived in before. The basement apartment is situated in the prestigious South Rosebank neighbourhood of Pickering (right on the ...	1,800.00	$
1558758013	https://media.kijiji.ca/api/v1/ca-prod-dealer-ads/images/56/5637b645-e5d3-475d-b595-17165df08e2d?rule=kijijica-200-jpg	Newly Renovated! Large 3 Bed + 2 Bath Concept W/ Dishwasher	11-09-2022	2022-09-11	City of Toronto	Beds: 3	At Last, This Is What Youve Been Searching For! Rosebury Square offers large spacious luxury apartments in the heart of city. Only a ten minute walk away from Eglinton West subway & the LRT. A six ... Location, Community, Spacious Living. It Starts Here!	3,124.00	$
1539126645	https://media.kijiji.ca/api/v1/ca-prod-dealer-ads/images/74/74b9e7e2-4d0b-4bdf-a2b9-8df243feb8bd?rule=kijijica-200-jpg	1 & 2 Bedroom - Apartment for Rent - North York - 2nd Month Free	11-09-2022	2022-09-11	North York	Beds: 1	OPEN HOUSE: Saturday (10 am - 3 pm) 1 & 2 Bedrooms Bright and Large Suite Featuring: MUST BE SEEN!!! 1 Bdm - $1,814 Parking & Hydro extra Unit Features: New Kitchen cabinets New Bathrooms Select ... Call Today! 647.333.0881	Please Contact	No currency provided
1631087173	https://media.kijiji.ca/api/v1/ca-prod-fsbo-ads/images/f8/f8d3f6ba-d048-4ccf-b646-6d6a02432e8a?rule=kijijica-200-jpg	CASA Condo, wrap-around Balcony @Yonge&Bloor/Charles/Yorkville	11-09-2022	2022-09-11	Toronto	Beds: 1 + Den	Luxury/ Extra Large 1 Bedroom Corner suite. High in-demand building at the heart of the city. A walkers Paradise. Move in Today!! A modern open concept layout, plenty of windows and natural ...	2,800.00	$
1632618694	No photo	Luxury condo living on yonge	11-09-2022	2022-09-11	Toronto	Beds: 1	Large, Super bright, Luxury living, at Yonge Street Condos featuring large WALKOUT Terrace in luxury boutique condo. HIGHLIGHTS AND FEATURES: • Boutique Building - Yonge At Lawrence Park • Gorgeous ...	Please Contact	No currency provided
1632618533	https://media.kijiji.ca/api/v1/ca-prod-fsbo-ads/images/11/1118f419-f85b-4840-873b-7f73da33da2b?rule=kijijica-200-jpg	Available Nov. 1  Stunning 2  bdr, 2 baths Apt. locker++Upgrades	11-09-2022	2022-09-11	Old Toronto	Beds: 2	Stunning and very bright approx. 900 sq. ft, 2 Bedrooms, 2 Bathrooms Corner Apartment, located on the 12th floor, right at the heart of the Entertainment District. The apartment comes with the ...	3,250.00	$
1632617976	https://media.kijiji.ca/api/v1/ca-prod-fsbo-ads/images/6c/6caac90f-3a76-4d10-b766-019cc63a8415?rule=kijijica-200-jpg	Bright Corner Condo 2 bds, 2 baths, Locker ++Upgrades November 1	11-09-2022	2022-09-11	Old Toronto	Beds: 2	This apartment just came on the market today and it is available as of November 1st 2022 or December 1st. Luxury modern new corner condo apartment, approx. 900 sq. ft with 2 balconies, 2 Bedrooms, 2. ...	3,250.00	$
1632617347	https://media.kijiji.ca/api/v1/ca-prod-fsbo-ads/images/b8/b8dc5205-9800-4b10-835e-7c38895f0257?rule=kijijica-200-jpg	Fully furnished 1 bedroom ALL INCLUSIVE	11-09-2022	2022-09-11	Toronto	Beds: 1	Unit on the 19th floor with great sunset view! Available immediately . Monthly amount will be pro-rated according to the number of days booked. Included: Utilities, wifi, Netflix, all linens, ...	5,000.00	$
1629348058	https://media.kijiji.ca/api/v1/ca-prod-fsbo-ads/images/c5/c586b9ff-bf37-47e0-aa5c-656aad1fe088?rule=kijijica-200-jpg	Renovated 2 BR Unit in Prime Junction Area w/ Laundry	11-09-2022	2022-09-11	Toronto	Beds: 2	Rarely offered 2 br 1 bathroom unit in 3 storey building at High Park Ave and Dundas St W. Absolutely prime junction location close to transit, grocery stores, local shops, cafes, restaurants, bars, ...	2,350.00	$
1632592721	https://media.kijiji.ca/api/v1/ca-prod-fsbo-ads/images/97/977a0155-34c1-4c2d-8bcd-19fc49ec2ce4?rule=kijijica-200-jpg	2 bedroom basement for rent	11-09-2022	2022-09-11	Toronto	Beds: 2	****AVAILABLE OCTOBER 1st**** FEMALES ONLY -Please send a brief message of your job status who and how many people will be living etc. As I will not be responding to “hi is this available” messages. ...	2,000.00	$
1632615415	No photo	1+1 bedrooms 1 washrooms condo for rent on Seppard and leslie	11-09-2022	2022-09-11	Toronto	Beds: 1 + Den	Welcome To Discovery Condos At Concord Parkplace! This Modern And Spacious 1 Br + Study Unit, A Modern Kitchen With Granite Counter Tops &Island, Laminate Flooring Throughout, 9 Ft Ceilings And A ...	2,300.00	$
1631585249	https://media.kijiji.ca/api/v1/ca-prod-fsbo-ads/images/d5/d52cde17-504e-4453-8678-76a4880bbfd8?rule=kijijica-200-jpg	Room for rent in a 2 bedroom, 900 sq ft. Forest Hill apartment	11-09-2022	2022-09-11	Toronto	Beds: 2	Unit: Room for rent in a 2 bedroom, 900 sq ft. apartment in Forest Hill Price: $1350 (includes utilities and internet. Hydro extra) Rent Control: Unit was used for residential purposes prior to Nov ...	1,295.00	$
1622256445	https://media.kijiji.ca/api/v1/ca-prod-dealer-ads/images/b1/b1225f9c-1f2e-4fce-8649-c5809ff860a9?rule=kijijica-200-jpg	Mid-Town Yonge and St Clair Upscale 1 Bedroom (Air Condition)	11-09-2022	2022-09-11	Toronto	Beds: 1	1 Bedroom with 650 sqft. starting at $1,949.00! Check out our website! www.commonwealthtowers.ca CALL , TEXT OR EMAIL TODAY TO BOOK A VIEWING! 416-825-8894 rentyph@outlook.com Upscale Rental Living ...	2,039.00	$
1630927276	https://media.kijiji.ca/api/v1/ca-prod-fsbo-ads/images/9b/9b6a9fbe-e7dc-43dc-8f44-7e7f45308c7c?rule=kijijica-200-jpg	NEW ALL INCLUSIVE BASEMENT FOR RENT IN SCARBOROUGH-	11-09-2022	2022-09-11	Toronto	Beds: 2	NEW ALL INCLUSIVE BASEMENT FOR RENT IN SCARBOROUGH- New All Inclusive2 Bedroom Basement Apt. With Separate Entrance. Laminate Floors, Pot lights, Large windows, 3 Piece Bath, En-suite Washer and ...	2,199.00	$
1632612704	https://media.kijiji.ca/api/v1/ca-prod-fsbo-ads/images/33/33c84f5e-7154-44f3-8eb2-b37d1c3493ad?rule=kijijica-200-jpg	Petit gorgeous 1 bedroom apt steps to keelesdale subway station	11-09-2022	2022-09-11	City of Toronto	Beds: 1	Located in the Keelesdale neighbourhood, this is a boutique, 6 unit Toronto apartment building. Ideal for a single or professional working couple. Apts include two separate entrances front and back. ...	1,800.00	$
1632612395	https://media.kijiji.ca/api/v1/ca-prod-fsbo-ads/images/f6/f6c2b8e4-9aca-4f24-bb4d-a07d3fb3f22c?rule=kijijica-200-jpg	3 Bedroom House for Rent	11-09-2022	2022-09-11	City of Toronto	Beds: 3	Charming bungalow available in a quiet neighborhood with a spacious backyard. Washer and dryer on main floor. Newly installed minisplit heat pump for efficient cooling and heating. Includes part of ...	3,100.00	$
1631152679	https://media.kijiji.ca/api/v1/ca-prod-dealer-ads/images/65/65c098a0-d7a5-427a-b9e3-3238b296c815?rule=kijijica-200-jpg	Bachelor available at 77 Huntley Street, Toronto	11-09-2022	2022-09-11	Toronto	Beds: Bachelor/Studio	Visit our Website: https://www.rpmsi.ca/property/huntley-apartments-77-huntley/ Come experience the Huntley Apartments. Featuring balconies and other upgrades, and only steps away from Sherbourne ...	1,675.00	$
1632611576	https://media.kijiji.ca/api/v1/ca-prod-fsbo-ads/images/2b/2b2b7209-eb3d-471e-a5ed-0512fa887431?rule=kijijica-200-jpg	Condo for Rent at STC	11-09-2022	2022-09-11	Scarborough	Beds: 2 + Den	2 Bedroom, 2 Bathroom, plus den spacious open concept apartment. Over 1000 square feet, facing south east with balcony. Includes  1 Parking space  In-suite laundry  Fridge, stove, wine cooler and ...	3,500.00	$
1632611052	https://media.kijiji.ca/api/v1/ca-prod-fsbo-ads/images/74/741d6014-6c13-4b6c-9bf4-5a444674bd56?rule=kijijica-200-jpg	Little Portugal - Trinity Bellwoods Apartment for Rent	11-09-2022	2022-09-11	Toronto	Beds: 2	This spacious Little Portugal apartment is over 1,000 square feet with a large open concept living space on the main floor and 2 bedrooms in the basement. Features high ceilings, lots of natural ...	2,450.00	$
1632569986	https://media.kijiji.ca/api/v1/ca-prod-fsbo-ads/images/ad/ad13f464-8e2b-4d97-95d9-037d7d29a18d?rule=kijijica-200-jpg	2Bed-room Basement apartment for rent at Scarborough	11-09-2022	2022-09-11	Toronto	Beds: 2	Basement apartment of a brand new house (construction finished November 2020) for rent. Spacious and thoughtfully designed 2 bedroom suite with a large living area and full-sized kitchen and in-suite ...	1,875.00	$
1632609762	https://media.kijiji.ca/api/v1/ca-prod-fsbo-ads/images/b0/b05121c6-9e3b-4a65-b390-7043dde1b332?rule=kijijica-200-jpg	15 HOLMES AVENUE - AZURA CONDOS - BRAND NEW 1 BEDROOM + DEN	11-09-2022	2022-09-11	Toronto	Beds: 1 + Den	* * * PLEASE REPLY FROM YOUR PERSONAL EMAIL ADDRESS FOR THE QUICKEST RESPONSE & AN APPLICATION FORM TO INFO@ELIZABETHGOULART.COM * * * WATCH THIS LIVE VIDEO TOUR: ...	2,500.00	$
1631209501	https://media.kijiji.ca/api/v1/ca-prod-fsbo-ads/images/b6/b68afe4a-2526-43f2-a2a9-c808a280e406?rule=kijijica-200-jpg	$2800-$2850 2 BDRM Newly Renovated Hillcrest Village Apartments	11-09-2022	2022-09-11	Toronto	Beds: 2	***NEWLY RENOVATED*** Desirable Wychwood neighbourhood. Air-conditioned, bright, spacious, 2 bedroom apartments with NEW kitchens, NEW quartz countertops, NEW bathrooms, NEW full-sized stainless ...	2,800.00	$
1505792263	https://media.kijiji.ca/api/v1/ca-prod-dealer-ads/images/ed/ed213a9c-f346-4a34-bd59-08ba23f5f490?rule=kijijica-200-jpg	Amazing Suite available!!! 2 BD	11-09-2022	2022-09-11	City of Toronto	Beds: 2	Welcome to Kipling Heights, a friendly west-end location, establihsed in an up and coming neighbourhood that makes it easy to settle in and get comfortable. A great destinaiton for family living with ... Kipling Heights	Please Contact	No currency provided
1632606911	https://media.kijiji.ca/api/v1/ca-prod-fsbo-ads/images/11/11f07876-dd75-4825-81b9-29eab3df6bd9?rule=kijijica-200-jpg	2 BEDROOM+2 BATH(UNION)SUBWAY)INCLUDES UTILITIES+BALCONY+OCT 1	11-09-2022	2022-09-11	Toronto	Beds: 2	Close to Highway 404 October 1, 2022 Moving in date Quiet Community, Separate Bright Unit, Around 1200 Sf, Renovated, Including Two Bedrooms, One Bathroom, One Living/Dining Room, One Kitchen. ...	3,100.00	$
1631981577	https://media.kijiji.ca/api/v1/ca-prod-fsbo-ads/images/41/41c79114-f684-46e6-9c81-b185c4a4f1cf?rule=kijijica-200-jpg	2 Bed 2 Bath for rent on Lakeshore, Toronto near the high park	06-09-2022	2022-09-06	City of Toronto	Beds: 2	Brand new beautiful 2 Bedroom 2 Bathroom spacious condo on Lakeshore Boulevard in High Park Swansea neighborhood is available for rent. The unit has S/S Fridge, Stove, Dishwasher, Microwave, Washer & ...	3,200.00	$
1631590806	https://media.kijiji.ca/api/v1/ca-prod-dealer-ads/images/56/56db1d8a-a397-456c-a03b-8592f38699d7?rule=kijijica-200-jpg	3 Bedroom - Pharmacy Place - Near Danforth & Victoria Park	08-09-2022	2022-09-08	City of Toronto	Beds: 3	Located only 10 minutes north of Lake Ontario and Ashbridges Bay Park. Only 20 minutes east of downtown Toronto on a major city bus route at the intersection of Pharmacy Ave. and Dolphin Drive. Three ...	2,500.00	$
1632655725	https://media.kijiji.ca/api/v1/ca-prod-fsbo-ads/images/05/054b47d6-d929-4e95-93e7-26e27de1a583?rule=kijijica-200-jpg	3 Bedroom BASEMENT for Rent: McCowan Road / Brimorton Drive	12-09-2022	2022-09-12	Toronto	Beds: 3	Video of the basement will be sent to inquiries. McCowan Road / Brimorton Drive: 3 Bedroom Bungalow House for Rent – Basement ONLY (WI-FI INCLUDED) AVAILABLE TO MOVE IN: OCTOBER 1, 2022 Lease: ...	2,500.00	$
1632655555	https://media.kijiji.ca/api/v1/ca-prod-fsbo-ads/images/07/07622447-5073-45af-97ee-109ab85f37af?rule=kijijica-200-jpg	Executive furnished condo - Bloor-Islington	12-09-2022	2022-09-12	Toronto	Beds: Bachelor/Studio	Beautiful executive condo available for rent starting Oct 1st, 2022 on a 1 year lease. Looking for a reliable and clean professional, preferably a female. Location is 9 Mabelle Ave. steps to ...	1,800.00	$
1632194162	https://media.kijiji.ca/api/v1/ca-prod-fsbo-ads/images/e1/e1ed5bdb-b5ff-4e08-9dc4-21e0ccf3d7c7?rule=kijijica-200-jpg	Bright, 1 bedroom apartment in Mimico with BALCONY, walk to GO	08-09-2022	2022-09-08	City of Toronto	Beds: 1	Located in beautiful Mimico village (Etobicoke - Royal York/Mimico Ave area) five minutes walk to GO, close to the Lake, shopping, restaurants, public transport, parks and other amenities Bright, ...	1,790.00	$
1625489341	https://media.kijiji.ca/api/v1/ca-prod-dealer-ads/images/16/167f9cc9-9c85-4c5a-aca5-b019d71763b7?rule=kijijica-200-jpg	Buy Condo with Zero Down near Lawrence / Kingston -RENT TO OWN	15-08-2022	2022-08-15	City of Toronto	Beds: 3	For Sale - BUY THIS CONDO WITH ZERO DOWN OR 5% DOWN PAYMENT PROGRAM Welcome To Very Spacious Apartment With 3 Bedrooms And A Large Living Room. Well Maintained Condo Apartment, Newly Painted & ...	Please Contact	No currency provided
1630106365	https://media.kijiji.ca/api/v1/ca-prod-dealer-ads/images/a0/a0ca493a-522b-4294-8f11-bc4be0b249b3?rule=kijijica-200-jpg	Renovated One bdrm suite at Queen St / roncensvalles	22-08-2022	2022-08-22	City of Toronto	Beds: 1	Completely renovated one bdrm suite in boutique apartment bldg . Walking score of 91, TTC at the corner , Walking distance to international mix of restaurants and bistros, vintage stores, indie ...	1,999.00	$
1632120276	https://media.kijiji.ca/api/v1/ca-prod-dealer-ads/images/e4/e46390c4-a807-4e41-8193-6dcd44f196ce?rule=kijijica-200-jpg	NOW PRELEASING: 1 Bedrooms - The Residences At The Well	11-09-2022	2022-09-11	Toronto	Beds: 1	Rent today and receive a one year membership to CLIO Social Club* Renting One, One+Den, Two, Two+Den and Three Bedroom Suites - Move in Starting February, 2023 Sophistication in Rental Living. ...	2,355.00	$
1631944763	https://media.kijiji.ca/api/v1/ca-prod-dealer-ads/images/ee/ee8d2597-c844-4866-9944-3b8ee9a352c0?rule=kijijica-200-jpg	Renovated one bedroom, DVP & Eglinton Ave East - ID 1147	06-09-2022	2022-09-06	Toronto	Beds: 1	Renovated Akelius one bedroom apartment for rent. Eglinton Avenue East and DVP in the North York neighborhood, Toronto. renovated one bedroom suite - 1 bathroom - located on floor 3 - approximately ...	1,800.00	$
1632590605	https://media.kijiji.ca/api/v1/ca-prod-dealer-ads/images/8c/8c96a7b7-f741-4deb-a7e6-fe4133f745cf?rule=kijijica-200-jpg	1 bdrm @ Avenue & St. Clair - 1 month free!	11-09-2022	2022-09-11	Toronto	Beds: 1	This fully renovated 1 bedroom in this desirable Forest Hill location is priced at $1,697 plus personal hydro Stainless steel fridge, stove, dishwasher, microwave Quartz Counter tops, modern ceramics ... Forest Hill Elegance!	1,697.00	$
1632592094	https://media.kijiji.ca/api/v1/ca-prod-fsbo-ads/images/97/97545714-704b-4e4d-8216-9b18c1203ba9?rule=kijijica-200-jpg	Queen st W Spadina,NOV1,2br,2flrden,1300ft,ovr shop,laundry$2750	11-09-2022	2022-09-11	Toronto	Beds: 2 + Den	Nov 1 avail, $2750 438 Queen st w, at Queen and Spadina, 2br,den, 1300 ft over nail shop, 1 full bath, one 2 piece, hardwood, Washer dryer, in great shape, very quiet and private only two units in ...	2,750.00	$
1632591946	https://media.kijiji.ca/api/v1/ca-prod-fsbo-ads/images/7e/7e736767-7bbb-4395-bfc7-d15813f4dd63?rule=kijijica-200-jpg	Downtown 2 Bedroom 2 Bathroom Condo w/ Utilities/Parking Nov 1st	11-09-2022	2022-09-11	Toronto	Beds: 2	Make this spacious 2 bedroom, 2 bathroom condo your new home! Located right downtown close to shopping, transit and easy highway access. Very spacious at 980 square feet, plus balcony, located on ...	2,800.00	$
1632591783	https://media.kijiji.ca/api/v1/ca-prod-fsbo-ads/images/28/288969d8-32c1-43c9-87ae-11980e93cf35?rule=kijijica-200-jpg	All Inclusive, Upper Beaches Apartment for Rent	11-09-2022	2022-09-11	Old Toronto	Beds: 1	All inclusive, furnished Upper Beaches walk-out apartment available for rent October 1st, 2022. Ground floor entrance: Fresh, updated 1 bedroom 1 bathroom apartment. Includes patio, kitchen, living ...	1,675.00	$
1591549538	https://media.kijiji.ca/api/v1/ca-prod-dealer-ads/images/6a/6a6a276c-8112-4ed6-bb0e-9b109556302f?rule=kijijica-200-jpg	SPACIOUS ONE BEDROOM + DEN!!	11-09-2022	2022-09-11	Toronto	Beds: 1 + Den	We have a beautiful renovated Waterfront One Bedroom Den. Multiple occupancy dates on a one year lease!! Flexible Move-In Dates!! CONTACT US FOR MORE DETAILS!! If you are interested in making an ...	2,497.00	$
1632590816	https://media.kijiji.ca/api/v1/ca-prod-fsbo-ads/images/23/23c79af8-31fc-436f-af07-78f65d38f143?rule=kijijica-200-jpg	One Bed Walkout B'ment Apt, 7 Min walk to Vic.Pak S/way.	11-09-2022	2022-09-11	Toronto	Beds: 1	One Bed Walkout B'ment Apt, 7 Min walk to Vic.Pak S/way. Extra clean One Bedroom Basement Apartment in a new house. Separate Entrance, No steps to basement its ground level walk-in, beautiful ...	1,400.00	$
1631277280	https://media.kijiji.ca/api/v1/ca-prod-dealer-ads/images/84/845085f1-237a-4428-8131-b3b120d16edc?rule=kijijica-200-jpg	Upscale 2 Bedroom Suite Don Mills & Sheppard Ave E	11-09-2022	2022-09-11	Toronto	Beds: 2	Our renovated apartments at 25 Leith Hill are conveniently located at Leith Hill Rd, near Don Mills Rd in Toronto's North York region. Please contact Lola at (416) 494-0521 to schedule a viewing. ...	2,549.00	$
1632588895	https://media.kijiji.ca/api/v1/ca-prod-fsbo-ads/images/c3/c3afd91b-5c9e-451b-9634-4203380fe61d?rule=kijijica-200-jpg	4-Bdrm 2-Story Entire Home w/basement apt and parking	11-09-2022	2022-09-11	Toronto	Beds: 4	Renovated and spacious entire 2-storey home including the basement apartment in a safe and desirable area. 3 bedrooms on the 2nd floor and 1 bedroom in a separate basement apartment. Home includes 2 ...	3,695.00	$
1632164764	https://media.kijiji.ca/api/v1/ca-prod-fsbo-ads/images/47/4768fb99-630e-46c2-857c-e8869cf53412?rule=kijijica-200-jpg	Newly Renovated 2 Bedroom Apartment For Rent	11-09-2022	2022-09-11	Toronto	Beds: 2	Fully renovated and light filled 2 bedroom apartment for rent. Includes Brand new kitchen with granite countertops and new stainless steel appliances. Brand new floors and carpet as well new bathtub ...	2,300.00	$
1632587957	https://media.kijiji.ca/api/v1/ca-prod-fsbo-ads/images/30/307d3e0e-c25c-4a30-b042-d5a5e38a1130?rule=kijijica-200-jpg	Newly renovated bedroom close to STC	11-09-2022	2022-09-11	Toronto	Beds: 1	Newly renovated bedroom close to STC: Close to bus stations and highway Close to Scarborough town center and subway station Separate entrance and laundry room All appliances are new Big back yard and ...	950.00	$
1505791612	https://media.kijiji.ca/api/v1/ca-prod-dealer-ads/images/df/dfa8c30f-87f1-4d62-83a6-4ce999400fa5?rule=kijijica-200-jpg	85-95 Gamble Ave. - 2Br. "Newly Renovated Suites"	11-09-2022	2022-09-11	City of Toronto	Beds: 2	Apartment for Rent in Toronto managed by Q Residential Ask about our Parking Promotion!!! Key Property Details Beautiful & Well Maintained Building Spacious living room & Plenty of closet space ...	2,200.00	$
1632587359	https://media.kijiji.ca/api/v1/ca-prod-fsbo-ads/images/4b/4bb3c7b8-54e1-48b0-8a0a-b0aef2b29601?rule=kijijica-200-jpg	1 Bedroom 1 Bathroom ALL INCLUDED fully furnished	11-09-2022	2022-09-11	Toronto	Beds: 1	Unit on the 19th floor with great sunset view! Available immediately . Monthly amount will be pro-rated according to the number of days booked. Included: Utilities, wifi, all linens, blankets, ...	5,000.00	$
1632587244	https://media.kijiji.ca/api/v1/ca-prod-fsbo-ads/images/f7/f79f5d79-f358-4fba-8d72-43f21082eaae?rule=kijijica-200-jpg	NOVEMBER 1st 2 BED & 2 FULL BATH - 1300 SQ F CONDO WITH PARKING	11-09-2022	2022-09-11	Etobicoke	Beds: 2	** FOR RENT BY OWNER ** (KIPLING/FINCH, STEELS/FINCH) – 3 ROWNTREE RD) **Please call / text 647-492-3757 to schedule a viewing** Don't Miss the Opportunity to rent this amazing 2 Bedroom, 2 Full ...	2,850.00	$
1632586767	https://media.kijiji.ca/api/v1/ca-prod-fsbo-ads/images/7f/7f043e45-bcce-4fc6-963b-dbaf9b2eebfe?rule=kijijica-200-jpg	Big And Spacious 3 Bedroom House Main Floor For Rent $2650	11-09-2022	2022-09-11	Toronto	Beds: 3	Bright and spacious 3 bedroom bungalow house main floor unit for rent at $2650. Large family kitchen, living room, dining room, spacious washroom. No 4 or more adults please. Tenant pays 65% ...	2,650.00	$
1632586315	https://media.kijiji.ca/api/v1/ca-prod-fsbo-ads/images/15/15a5fc31-9c80-4ed2-ba9e-469caf7c8cb1?rule=kijijica-200-jpg	Main Unit for Rent - Port Union & Lawrence Area (utilities inc.)	11-09-2022	2022-09-11	Toronto	Beds: 3	Main Unit with 3 bedrooms and 1 washroom for rent in high demand Port Union and Lawrence area. Main unit consist of main level and upper level with 3 bedrooms and 1 washroom. One Parking spot is also ...	2,480.00	$
1632585920	https://media.kijiji.ca/api/v1/ca-prod-fsbo-ads/images/be/bedc2597-f9b1-4bec-8256-dac2a63f5463?rule=kijijica-200-jpg	2 Bed/2 Bath Furnished Condo Unit on King St	11-09-2022	2022-09-11	Toronto	Beds: 2	*Fully Furnished* Bright & Airy High Floor Corner Unit On Iconic King Street West In The Heart Of The Entertainment District. This 850+ Sqft Unit Offers 2- Bed, 2 Bath Unit, Functional Split Layout. ...	4,100.00	$
1624914604	https://media.kijiji.ca/api/v1/ca-prod-fsbo-ads/images/c7/c739a2b9-362f-4545-95bb-9768ed340e4b?rule=kijijica-200-jpg	LESLIEVILLE ONE BEDROOM & DEN APARTMENT FOR RENT $2,250/month	11-09-2022	2022-09-11	Toronto	Beds: 1 + Den	LESLIEVILLE APARTMENT FOR RENT Features • A charming large one bedroom, ground level apartment located in a Leslieville • located in a quiet and tranquil duplex with two rented apartments • Located ...	2,250.00	$
1632585571	https://media.kijiji.ca/api/v1/ca-prod-fsbo-ads/images/36/36f5861c-1223-4e8b-bdcf-ab26a0452bdc?rule=kijijica-200-jpg	Upgraded One Bedroom Apartment	11-09-2022	2022-09-11	Old Toronto	Beds: 1	Beautiful One Bedroom Apartment In Prime Area Of High Park, White Kitchen Cabinets With Ceramic Floor, 4 Piece Bathroom, Living Room And Bed Room With Laminated Floors, Comes With A Cozy Balcony And ...	1,740.00	$
1632585487	https://media.kijiji.ca/api/v1/ca-prod-fsbo-ads/images/4b/4b57133d-58b3-4dd6-855f-2b724678a4fe?rule=kijijica-200-jpg	Two Bedroom walk-out Basement Apartment for Rent in Scarborough	11-09-2022	2022-09-11	Toronto	Beds: 2	Bright and Spacious two Bedroom walk-out Basement apartment for rent in Scarborough near Lawrence E & Kingston Rd. Very quiet neighborhood. Few minutes walk to TTC and Go Transit, easy to commute ...	1,675.00	$
1632584609	https://media.kijiji.ca/api/v1/ca-prod-fsbo-ads/images/51/518d1eb7-da1c-43d8-8c9b-819b6e860c93?rule=kijijica-200-jpg	1+1 Bedroom Condo for Lease – Dundas / Jones	11-09-2022	2022-09-11	Toronto	Beds: 1 + Den	Recently converted church in the heart of Riverdale. Multi-level unit. Ensuite laundry. Storage locker. 1 parking spot. Available November 1. $2,600/month + utilities. If you have any questions or ...	2,600.00	$
1632525206	https://media.kijiji.ca/api/v1/ca-prod-fsbo-ads/images/a9/a91913d7-65df-4e5c-9771-bb9181813d36?rule=kijijica-200-jpg	Rent available	11-09-2022	2022-09-11	North York	Beds: 4	House in Tiny township (Ontario) close to Midland town, with 4 bedrooms, 2 bathrooms, one with walk in shower with double sink, 2nd floor bathroom with bathroom with 2 sink as well, 3 car garage, ...	Please Contact	No currency provided
1632583393	https://media.kijiji.ca/api/v1/ca-prod-fsbo-ads/images/4b/4bd815eb-2d2d-4365-9333-5f3b253aaf72?rule=kijijica-200-jpg	New lease	11-09-2022	2022-09-11	Markham	Beds: 2 + Den	Welcome To Prime Thornhill! Steps From Ttc Steeles! 27 Story Premium Boutique Building. South Facing Unit W/Incredible Unobstructed Views Of Downtown. 2 Bed + Den & 2 Full Baths.Open Concept Living ...	Please Contact	No currency provided
1632583353	https://media.kijiji.ca/api/v1/ca-prod-fsbo-ads/images/d8/d8bcf3ac-eb7b-4950-8d7c-c9b72706573a?rule=kijijica-200-jpg	1 Bedroom Condo for Lease – Yonge / Sheppard	11-09-2022	2022-09-11	Toronto	Beds: 1	1 bedroom condo in North York. Ensuite laundry. 1 parking spot. Available immediately. $2,275/month + heat & hydro. If you have any questions or would like to book an appointment please contact ...	2,275.00	$
1632583195	https://media.kijiji.ca/api/v1/ca-prod-fsbo-ads/images/43/43bf4c51-e745-46df-8ff3-1aa7fc237e0f?rule=kijijica-200-jpg	Basement unit with 2 bedrooms on 401/Markham for rent	11-09-2022	2022-09-11	Toronto	Beds: 2	Please read ads carefully and save our time. Only one couple or not more than three people are accepted, rent not including utilities. Start rent from Oct 1 or Nov1, refuse rooming. The bungalow just ...	1,600.00	$
1632583120	https://media.kijiji.ca/api/v1/ca-prod-fsbo-ads/images/c4/c497d35a-e58b-487c-9831-cab79aca9ef1?rule=kijijica-200-jpg	5 BEDROOMS DETACHED HOUSE	11-09-2022	2022-09-11	Toronto	Beds: 5+	IDEAL LOCATION: Markham/Eglinton. 5 mins walk to all amenities in area. Walmart, Metro, Schools, Doctors, Malls, Bus to Kennedy Subway. Property is spacious and is on a large open space with a ...	3,400.00	$
1632582752	https://media.kijiji.ca/api/v1/ca-prod-dealer-ads/images/27/27ddd49e-a0d4-475b-911f-689c4fb2b5de?rule=kijijica-200-jpg	2bdrm penthouse with private rooftop patio at Finch / Sentinel	11-09-2022	2022-09-11	Toronto	Beds: 2	2 bdrm apartment- 2 level penthouse unit has private rooftop patio Hardwood floors throughout TTC at your doorstep Walking distance to York unity, shops Available Oct 15 or Nov 1 Rent is $2500 ...	2,500.00	$
1632581868	https://media.kijiji.ca/api/v1/ca-prod-fsbo-ads/images/6f/6f99d8f6-5863-486a-bcd3-580e4ab16d22?rule=kijijica-200-jpg	Basement unit with 4 bedrooms on Lawrence W/Black creek for rent	11-09-2022	2022-09-11	Toronto	Beds: 4	Basement unit with 4 bedrooms on Lawrence West/Black creek for rent. Please read ads carefully and save our time. Only one family or not more than four people are accepted, rent not including ...	1,900.00	$
1632581076	https://media.kijiji.ca/api/v1/ca-prod-fsbo-ads/images/58/58da1c3b-14ff-46fe-aaef-5f094ac6cdc8?rule=kijijica-200-jpg	Main floor unit with 3 bedrooms on Lawrence/Black creek for rent	11-09-2022	2022-09-11	Toronto	Beds: 3	Main floor unit with 3 bedrooms on Lawrence West/Black creek for rent. Please read ads carefully and save our time. Only one family or not more than four people are accepted, rent not including ...	2,550.00	$
1632580953	https://media.kijiji.ca/api/v1/ca-prod-fsbo-ads/images/11/116a8229-bb84-45d9-a0af-910351f481be?rule=kijijica-200-jpg	Basement apartment with separate entrance. Close to UTSC, GOand	11-09-2022	2022-09-11	City of Toronto	Beds: 1	Suitable for bachelor or small family.	1,550.00	$
1632580454	https://media.kijiji.ca/api/v1/ca-prod-fsbo-ads/images/cd/cd420b59-7146-4c72-9548-017ee5bd7e2c?rule=kijijica-200-jpg	Large 2 Bdrm walk-out $2500/mo inclusive	11-09-2022	2022-09-11	Toronto	Beds: 2	$2500/mo inclusive. Tenant pays their own cable/internet and permit for street parking. Large 2 bedroom apartment available immediately. Newly renovated. 2 Bdrm 1 bath S/S full-size appliances ...	2,500.00	$
1632580147	https://media.kijiji.ca/api/v1/ca-prod-fsbo-ads/images/31/31d74552-ceaf-43c0-8668-0d1345d17f8e?rule=kijijica-200-jpg	Apartment for Rent	11-09-2022	2022-09-11	Toronto	Beds: 1	A fully renovated 1 bedroom with a living room, fully complete gorgeous kitchen with a laundry room located in the back and 1 parking spot. Walking distance to Dufferin and St. Clair $3200 per month ...	3,200.00	$
1569156992	https://media.kijiji.ca/api/v1/ca-prod-dealer-ads/images/15/1598eda4-9e4d-4737-9307-3bbf2e179973?rule=kijijica-200-jpg	Big Bright 3 Bed Loft - Furnished & All Inclusive	11-09-2022	2022-09-11	City of Toronto	Beds: 3	Beautiful 3 bedroom Loft/Condo. Located at Lansdowne and Dupont minutes from the The Junction, trendy restaurants & boutiques, Farmer's Markets, Street Festivals. Short walk to Lansdowne Subway ...	4,100.00	$
1632578464	https://media.kijiji.ca/api/v1/ca-prod-fsbo-ads/images/e4/e4f68c02-9823-4873-9c92-de25297e051e?rule=kijijica-200-jpg	►►► Studio by the lake-Avail. Now ►►►	11-09-2022	2022-09-11	Toronto	Beds: Bachelor/Studio	Prime South Etobicoke by the lake Available Now **Bright open concept Studio Unit in a quiet low rise building by the lake **5 min walk from Humber College **High ceilings, South facing Suite **Easy ...	1,199.00	$
1632578035	https://media.kijiji.ca/api/v1/ca-prod-fsbo-ads/images/f3/f3048d4a-b952-4b93-8070-fdd0d6a176fc?rule=kijijica-200-jpg	Basement apartment	11-09-2022	2022-09-11	City of Toronto	Beds: 1	1 bedroom basement apartment in high desirable location in Scarborough. , separate entrance, full kitchen, full washroom & laundry,large bedroom,WiFi included,No cable TV, some furniture available. ...	1,700.00	$
1632578005	https://media.kijiji.ca/api/v1/ca-prod-fsbo-ads/images/e4/e4f63947-3a5e-4800-b84e-1cc6b860b9fc?rule=kijijica-200-jpg	Fully furnished sublet Yonge/St.Clair	11-09-2022	2022-09-11	Toronto	Beds: 1	Offering FULLY furnished 1 bedroom apartment in a 2 storey building (not a condo) 5 min walking to Yonge and St Clair subway For a Minimum of 1 year from 1st of NOVEMBER Suitable for a quiet & non ...	1,750.00	$
1632577967	https://media.kijiji.ca/api/v1/ca-prod-fsbo-ads/images/63/638395e0-4c4d-4877-8d9d-00fcbc15d66b?rule=kijijica-200-jpg	Basement unit with 2 bedrooms on 401/Markham Ave for rent	11-09-2022	2022-09-11	Toronto	Beds: 2	Please read ads carefully and save our time. Only one couple or not more than three people are accepted, rent not including utilities. Start rent from Oct 1, refuse rooming. Newly renovated so no new ...	1,600.00	$
1632577849	https://media.kijiji.ca/api/v1/ca-prod-fsbo-ads/images/01/01b60588-e1eb-49ba-a1ee-ebc6a3c2a7a2?rule=kijijica-200-jpg	►►► 1BR Appartment by the lake-Avail. November 1 ►►►	11-09-2022	2022-09-11	Toronto	Beds: 1	Nice & bright south etobicoke by the lake 1 BR unit Available November 1 **Bright open concept Studio Unit in a quiet low rise building by the lake **5 min walk from Humber College **High ceilings, ...	1,795.00	$
1632577730	https://media.kijiji.ca/api/v1/ca-prod-fsbo-ads/images/df/df9b23fb-154d-4dfd-beb5-a9830b7be321?rule=kijijica-200-jpg	Modern and Spacious 2-Bedroom Lower Level apartment	11-09-2022	2022-09-11	Toronto	Beds: 2	Bright, modern and spacious lower-level apartment. Bright and modern Open Concept Kitchen and Living room with Oversized Windows, stainless steel appliances, 2 Bedrooms, Fireplace, 3-piece Bathroom ...	1,890.00	$
1631154490	https://media.kijiji.ca/api/v1/ca-prod-dealer-ads/images/eb/eb209d77-c8d5-40af-b82d-9606f3d6d146?rule=kijijica-200-jpg	Two Bedroom Plus Den Penthouse  | Minto Yorkville Penthouse for	11-09-2022	2022-09-11	Toronto	Beds: 2 + Den	Utilities Included Heat Water Oversized, premium, and pet friendly suites designed with an open concept layout, floor-to-ceiling windows, private balconies, in-suite laundry and storage space, air ... Premium Two Bedroom Plus Den Penthouse Suite	10,989.00	$
1544545679	https://media.kijiji.ca/api/v1/ca-prod-dealer-ads/images/26/2620b8ed-0a16-43b6-9a5d-4770fc4b0cd1?rule=kijijica-200-jpg	LARGE FULLY RENOVATED 1 BEDROOM	11-09-2022	2022-09-11	Toronto	Beds: 1	Graydon Hall is located In the heart of North York. Don Mills is a community that was designated as a heritage site. A quick five-minute walk to schools and huge suites makes 20 Graydon Hall a choice ...	2,200.00	$
1631346308	https://media.kijiji.ca/api/v1/ca-prod-dealer-ads/images/b6/b60547b5-fcfa-49dd-84b5-5d2d96439728?rule=kijijica-200-jpg	Executive Furnished 1 Bedroom Suites on Avenue Road	09-09-2022	2022-09-09	City of Toronto	Beds: 1	Offering beautifully renovated and furnished suites and modern kitchens, these buildings are a definite must-see! Visit the rental office at 330 Avenue Road. Community With proximity to transit, ... Executive Furnished Suites	2,771.00	$
1632325239	https://media.kijiji.ca/api/v1/ca-prod-fsbo-ads/images/11/11138509-5af3-4582-b58c-75daacffeb5f?rule=kijijica-200-jpg	NEWLY RENOVATED 2 Bedroom 2 Bath Basement For Rent Scarborough	09-09-2022	2022-09-09	Toronto	Beds: 2	Brand New and Newly Renovated Basement for Rent in Scarborough This beautiful 2 bedroom 2 bathroom basement apartment has a separate entrance. Brand new laminate and tile (kitchen) floors. Pot lights ...	2,150.00	$
1608034067	https://media.kijiji.ca/api/v1/ca-prod-dealer-ads/images/2f/2f710d63-3307-48cd-bd38-470dcd48abb2?rule=kijijica-200-jpg	1 Bedroom Large Apt. for Rent Steps to Victoria Park Station!	02-09-2022	2022-09-02	City of Toronto	Beds: 1	Touch free leasing: Virtual viewings via video conferencing and online leasing available. Book yours today. Our Rental Office remains operational in light of COVID-19. The health and safety of you, ... Proudly Managed by Realstar Management! Cambridge Place Apartments Offers Bachelor, 1, 1-Bedroom Large, 2 and 3-Bedroom Suites! Office Open Daily!	1,795.00	$
1631325729	https://media.kijiji.ca/api/v1/ca-prod-fsbo-ads/images/a6/a633f40f-7a7c-4713-8b23-a56307700fa2?rule=kijijica-200-jpg	Large 1 Bedroom Corner suite. In-demand @Yonge/Bloor/Yorkville	09-09-2022	2022-09-09	City of Toronto	Beds: 1	Over 900sq feet of total living space | 700 sq ft interior **unoccupied / professionally painted and cleaned. Available for Immediate Occupancy! Suite Features: - 3 Walk-Outs to A Wrap-Around Balcony ...	2,800.00	$
1630689750	https://media.kijiji.ca/api/v1/ca-prod-fsbo-ads/images/4a/4acc1976-d391-44a8-b12c-7b23d2778862?rule=kijijica-200-jpg	For Rent: Ground-floor furnished studio apartment with backyard	09-09-2022	2022-09-09	City of Toronto	Beds: Bachelor/Studio	Spacious, furnished, beautiful ground-floor studio apartment with backyard and private laundry amenities. All utilities included. Studio features: - Furnishing - Fridge - Cooktop - Microwave/Oven - ...	1,700.00	$
1548012157	https://media.kijiji.ca/api/v1/ca-prod-dealer-ads/images/89/89756900-8921-41ac-bc71-b55d287da01f?rule=kijijica-200-jpg	Finch and Bathurst: 3 Goldfinch Court, SPACIOUS 1BR AVAILABLE!!	11-09-2022	2022-09-11	City of Toronto	Beds: 1	Apartment for Rent in Toronto managed by Q Residential Key Property Details Newly renovated suites and under new management Onsite Laundry & Parking! Convenient Access to Hwy 401 & to Many Amenities! ...	1,750.00	$
1626695997	https://media.kijiji.ca/api/v1/ca-prod-fsbo-ads/images/db/dbf5ecbb-467c-4b28-8502-0cd0c5e006b5?rule=kijijica-200-jpg	2 Bedrooms Bloor West Village	11-09-2022	2022-09-11	Toronto	Beds: 2	Located In Highly Desirable High Park - Swansea Neighborhood, This Beautifully Renovated 2 Bedroom Apartment Has Been Completely Redone, Features New Modern Kitchen With Brand New Stainless Steel ...	3,000.00	$
1533904381	https://media.kijiji.ca/api/v1/ca-prod-dealer-ads/images/49/491f8d2f-ec8d-4f96-8734-2ed435902357?rule=kijijica-200-jpg	Downtown 2 Bedrooms Apartment for Rent - 191 Sherbourne Street	11-09-2022	2022-09-11	City of Toronto	Beds: 2	Current Promotions View our units by clicking the virtual tour link, schedule a video tour or make an appointment for in person viewing.(289) 277 7008Virtual Open House: View our units by clicking ... Beatifully renovated large apartments for rent Dowtown Toronto	2,575.00	$
1632600866	https://media.kijiji.ca/api/v1/ca-prod-fsbo-ads/images/ea/eaa785d6-1166-4a53-bc43-d3f36acca0c9?rule=kijijica-200-jpg	Apartment for rent starting Oct 1st	11-09-2022	2022-09-11	Toronto	Beds: 1 + Den	Available October 1st 1 Bed + 1 Unit Located In Core Downtown Toronto Condo Next To Park & Library, Steps To The Lake, Ttc & Steps To Union Station & Bathurst streetcart *24/7 Concierge Excellent ...	2,600.00	$
1632646870	https://media.kijiji.ca/api/v1/ca-prod-dealer-ads/images/2c/2c3c4b23-ef20-4b83-9aeb-369a37168690?rule=kijijica-200-jpg	Sheppard/victoria park,October,31bedrms + 2 living,ELEGNT renova	11-09-2022	2022-09-11	Scarborough	Beds: 3	Sheppard/victoria park,MOVE October,1st 3 bedrms + 2 living room,elegant renovated,LUXURY OPEN CONCEPT ISLAND ,5 stainless steele appliance,BEAUTIFUL BACKYARD for entertainment,2 parking,suitable for ...	2,885.00	$
1632645415	https://media.kijiji.ca/api/v1/ca-prod-fsbo-ads/images/9c/9cf08041-64b7-4d6c-afce-189d6e9a7e1f?rule=kijijica-200-jpg	Tridel Built One Bedroom Plus Den Condo	11-09-2022	2022-09-11	Toronto	Beds: 1 + Den	Spacious 1 Bedroom Plus Den That Could Be Converted to 2nd Bedroom In Practical Layout. 37th Floor Facing South With Unobstructed Stunning Don Valley & City Views. Hotel Grade Facilities: Well ...	2,400.00	$
1610877454	https://media.kijiji.ca/api/v1/ca-prod-dealer-ads/images/97/97531274-435f-4ee9-9646-418555863314?rule=kijijica-200-jpg	Scarborough 2 Bedroom Apartment for Rent - 3895 Lawrence Avenue,	11-09-2022	2022-09-11	Scarborough	Beds: 2	Current Promotions View our units by clicking the virtual tour link, schedule a video tour or make an appointment for in person viewing.Virtual Open House: View our units by clicking the virtual tour ...	2,279.00	$
1568954850	https://media.kijiji.ca/api/v1/ca-prod-dealer-ads/images/fb/fb80e42e-8244-4f82-9324-c419dac036dc?rule=kijijica-200-jpg	Scarborough 1 Bedroom Apartment for Rent - 1320 Danforth Road	11-09-2022	2022-09-11	Scarborough	Beds: 1	Current Promotions View our units by clicking the virtual tour link, schedule a video tour or make an appointment for in person viewing. Open House Incentives! (437) 747-5214Virtual Open House: View ...	1,814.00	$
1627159121	https://media.kijiji.ca/api/v1/ca-prod-dealer-ads/images/4b/4b047e61-f536-4050-a23f-52b5e6af4eec?rule=kijijica-200-jpg	Scarborough 3 Bedroom Apartment for Rent - 1360 Danforth Road	11-09-2022	2022-09-11	City of Toronto	Beds: 3	Current Promotions View our units by clicking the virtual tour link, schedule a video tour or make an appointment for in person viewing. Open House Incentives! (647) 696-7899Virtual Open House: View ...	2,729.00	$
1632564087	https://media.kijiji.ca/api/v1/ca-prod-dealer-ads/images/ba/ba7ff7bc-5234-42b0-b11a-d22606a4c907?rule=kijijica-200-jpg	Downtown 1 Bedroom Apartment for Rent - 77 Wellesley Street East	11-09-2022	2022-09-11	Toronto	Beds: 1	Current Promotions View our units by clicking the virtual tour link, schedule a video tour or make an appointment for in person viewing. Call: (647) 424-1549Virtual Open House: View our units by ...	2,101.00	$
1568954381	https://media.kijiji.ca/api/v1/ca-prod-dealer-ads/images/83/836a5fd7-2009-44b1-9d16-a71233773480?rule=kijijica-200-jpg	Scarborough 2 Bedroom Apartment for Rent - 1350 Danforth Road	11-09-2022	2022-09-11	Scarborough	Beds: 2	Current Promotions View our units by clicking the virtual tour link, schedule a video tour or make an appointment for in person viewing. Open House Incentives! (647) 696-7899Virtual Open House: View ...	2,107.00	$
1568954929	https://media.kijiji.ca/api/v1/ca-prod-dealer-ads/images/8e/8e3e4e55-83e1-4e03-b2f9-89c86b0bdcb9?rule=kijijica-200-jpg	Scarborough 2 Bedroom Apartment for Rent - 1340 Danforth Road	11-09-2022	2022-09-11	Scarborough	Beds: 2	Current Promotions View our units by clicking the virtual tour link, schedule a video tour or make an appointment for in person viewing. Open House Incentives! (647) 696-7899Virtual Open House: View ...	2,112.00	$
1604335447	https://media.kijiji.ca/api/v1/ca-prod-dealer-ads/images/17/178cbdd3-3bc0-4542-81af-911a4770957f?rule=kijijica-200-jpg	Scarborough 3 Bedroom Apartment for Rent - 1350 Danforth Road	11-09-2022	2022-09-11	Scarborough	Beds: 3	Current Promotions View our units by clicking the virtual tour link, schedule a video tour or make an appointment for in person viewing. Open House Incentives! (647) 696-7899Virtual Open House: View ...	2,784.00	$
1568954269	https://media.kijiji.ca/api/v1/ca-prod-dealer-ads/images/8a/8a125587-96a7-4e22-8e28-3012ee68dd13?rule=kijijica-200-jpg	Scarborough 2 Bedroom Apartment for Rent - 1360 Danforth Road	11-09-2022	2022-09-11	Scarborough	Beds: 2	Current Promotions View our units by clicking the virtual tour link, schedule a video tour or make an appointment for in person viewing. Open House Incentives! (647) 696-7899Virtual Open House: View ...	2,179.00	$
1568954539	https://media.kijiji.ca/api/v1/ca-prod-dealer-ads/images/f5/f5dd4690-826c-4f65-bba0-ea782f357cfd?rule=kijijica-200-jpg	Scarborough 1 Bedroom Apartment for Rent - 1350 Danforth Road	11-09-2022	2022-09-11	Scarborough	Beds: 1	Current Promotions View our units by clicking the virtual tour link, schedule a video tour or make an appointment for in person viewing. Open House Incentives! (647) 696-7899Virtual Open House: View ...	1,624.00	$
1568954917	https://media.kijiji.ca/api/v1/ca-prod-dealer-ads/images/7c/7c429334-54ab-4115-a6a6-129b335af7b3?rule=kijijica-200-jpg	Scarborough 1 Bedroom Apartment for Rent - 1330 Danforth Road	11-09-2022	2022-09-11	Scarborough	Beds: 1	Current Promotions View our units by clicking the virtual tour link, schedule a video tour or make an appointment for in person viewing. Open House Incentives! (437) 747-5214Virtual Open House: View ...	1,854.00	$
1505788097	https://media.kijiji.ca/api/v1/ca-prod-dealer-ads/images/50/5010fb81-0559-410b-8563-f09c65b82ae6?rule=kijijica-200-jpg	Downtown 1 Bedroom Apartment for Rent - 15 Dundonald Street	11-09-2022	2022-09-11	Toronto	Beds: 1	Current Promotions View our units by clicking the virtual tour link, schedule a video tour or make an appointment for in person viewing. Call: (647) 492-7020Virtual Open House: View our units by ...	2,166.00	$
1632564092	https://media.kijiji.ca/api/v1/ca-prod-dealer-ads/images/75/7564263b-d56a-44d5-bdf4-4c470ded5cd8?rule=kijijica-200-jpg	Scarborough 1 Bedroom Apartment for Rent - 1340 Danforth Road	11-09-2022	2022-09-11	Scarborough	Beds: 1	Current Promotions View our units by clicking the virtual tour link, schedule a video tour or make an appointment for in person viewing. Open House Incentives! (647) 696-7899Virtual Open House: View ...	1,714.00	$
1572085918	https://media.kijiji.ca/api/v1/ca-prod-dealer-ads/images/a2/a21e5021-5d2a-4a8f-97e9-73b57f8037b9?rule=kijijica-200-jpg	Parkdale 1 Bedroom Apartment for Rent - 146 Jameson Avenue	11-09-2022	2022-09-11	City of Toronto	Beds: 1	Current Promotions Please view our available units by clicking on the virtual tour below. Call now: (437) 886-5105Virtual Open House: Please view our available units by clicking on the virtual tour ...	1,849.00	$
1566394136	https://media.kijiji.ca/api/v1/ca-prod-dealer-ads/images/25/2575339f-5860-479a-b81a-e736d0c54be9?rule=kijijica-200-jpg	Parkdale 1 Bedroom Apartment for Rent - 140 Jameson Avenue	11-09-2022	2022-09-11	City of Toronto	Beds: 1	Current Promotions Please view our available units by clicking on the virtual tour below. Call now: (437) 886-5105Virtual Open House: Please view our available units by clicking on the virtual tour ...	1,899.00	$
1518505263	https://media.kijiji.ca/api/v1/ca-prod-dealer-ads/images/ae/aebd8380-1159-48cb-921d-1160e700104e?rule=kijijica-200-jpg	Parkdale Bachelor Apartment for Rent - 140 Jameson Avenue	11-09-2022	2022-09-11	City of Toronto	Beds: Bachelor/Studio	Current Promotions Please view our available units by clicking on the virtual tour below. Call now: (437) 886-5105Virtual Open House: Please view our available units by clicking on the virtual tour ...	1,549.00	$
1627659179	https://media.kijiji.ca/api/v1/ca-prod-dealer-ads/images/da/da4068a5-4a11-4436-ae91-a7a49725b8a7?rule=kijijica-200-jpg	Parkdale 2 Bedroom Apartment for Rent - 90 Jameson Avenue	11-09-2022	2022-09-11	City of Toronto	Beds: 2	Current Promotions Please view our available units by clicking on the virtual tour below. Call now: (437) 886-5105Virtual Open House: Please view our available units by clicking on the virtual tour ...	2,349.00	$
1623976231	https://media.kijiji.ca/api/v1/ca-prod-dealer-ads/images/5c/5ce5c95b-305b-4e86-ac42-5d5ed793c05f?rule=kijijica-200-jpg	Parkdale Bachelor Apartment for Rent - 90 Jameson Avenue	11-09-2022	2022-09-11	City of Toronto	Beds: Bachelor/Studio	Current Promotions Please view our available units by clicking on the virtual tour below. Call now: (437) 886-5105Virtual Open House: Please view our available units by clicking on the virtual tour ...	1,599.00	$
1623099496	https://media.kijiji.ca/api/v1/ca-prod-dealer-ads/images/fa/fa61647a-e8f1-43cf-9f59-c4dc46aac913?rule=kijijica-200-jpg	Jameson and Lakeshore Parkdale 1 Bedroom Apartment for Rent - 90	11-09-2022	2022-09-11	City of Toronto	Beds: 1	Current Promotions Please view our available units by clicking on the virtual tour below. Call now: (437) 886-5105Virtual Open House: Please view our available units by clicking on the virtual tour ...	1,949.00	$
1632641690	https://media.kijiji.ca/api/v1/ca-prod-fsbo-ads/images/15/15ea159a-7cbb-4c55-bc29-5bdf6f7bade4?rule=kijijica-200-jpg	One Bedroom Basement Apartment	11-09-2022	2022-09-11	Etobicoke	Beds: 1	Basement Apartment $1200 Nov 1 Islington & Lakeshore Close to Humber College South Campus. One bedroom, full bath, shared laundry, 3 closets, new floors. Includes everything (internet, hydro, ...	1,200.00	$
1632640746	https://media.kijiji.ca/api/v1/ca-prod-fsbo-ads/images/94/94e489db-d11e-48f5-a83f-431237d0e587?rule=kijijica-200-jpg	Yonge and Bloor furnished studio	11-09-2022	2022-09-11	Toronto	Beds: Bachelor/Studio	Downtown Toronto 101 Charles St. East furnished studio available for rent from Oct 1. Unobstructed North Facing View furnished bachelor. Close to UFT. The X2 Condominium is located in the Prestigious ...	2,250.00	$
1632640647	https://media.kijiji.ca/api/v1/ca-prod-fsbo-ads/images/c0/c0001fdc-0c01-4262-8a4c-4f2b86c17634?rule=kijijica-200-jpg	LESLIE & FINCH ~ STUDENT WELCOME	11-09-2022	2022-09-11	Toronto	Beds: 3	Upper Unit Only, Prime North York Location.Steps To School,Park,Waling Distance To Finch(1 Minute).Seneca College. Supermarket,Go Transit&Ttc, Close To Hwy 401/404,North York General Hospital, ...	2,800.00	$
1632640367	https://media.kijiji.ca/api/v1/ca-prod-fsbo-ads/images/91/9191abc6-4d1d-42da-8774-ed4adb21515e?rule=kijijica-200-jpg	One Bedroom Basement Apartment	11-09-2022	2022-09-11	Toronto	Beds: 1	Basement Apartment $1200 Nov 1 Islington & Lakeshore Close to Humber College South Campus. One bedroom, full bath, shared laundry, 3 closets, new floors. Includes everything (internet, hydro, ...	1,200.00	$
1632640268	https://media.kijiji.ca/api/v1/ca-prod-fsbo-ads/images/a6/a6b84089-a63d-4333-8a17-179598fffb5e?rule=kijijica-200-jpg	STUDENTS WELCOME ~ WARDEN & KINGSTON	11-09-2022	2022-09-11	Toronto	Beds: 4	Detached House For Rent. ** Students Welcome **. Location Location Location, Welcome To The Highly Sought After Birchcliff Village, Easily Accessible To Public Transit, Birch Cliff P.S, Beep Sports ...	3,000.00	$
1632625686	https://media.kijiji.ca/api/v1/ca-prod-fsbo-ads/images/70/705cd1d4-eec4-464c-a07f-cc7f7cc88b25?rule=kijijica-200-jpg	Condo for rent in Yonge and Sheppard 2+1 Bed	11-09-2022	2022-09-11	Toronto	Beds: 2 + Den	DESCRIPSION: Luxury Condo In The Heart Of North York. Spacious Unit With Large Balcony. Living And Master Bedroom W/O To Balcony. Excellent Location. Granite Counter-Tops In Kitchen & Bathrooms. ...	3,800.00	$
1632630658	https://media.kijiji.ca/api/v1/ca-prod-fsbo-ads/images/d0/d07319f9-cf03-4489-9cd2-85b6e21c6b8e?rule=kijijica-200-jpg	King Street West Shared 2 Bedroom 2 Bath Condo for rent	11-09-2022	2022-09-11	Old Toronto	Beds: 2	Trendy King West Room For Rent October 1st (preference given to female professional) Perfectly self-contained furnished 840 sq.ft private 2 bedroom + 2 bathrooms in Toronto's trendy Liberty/King West ...	1,400.00	$
1632634900	https://media.kijiji.ca/api/v1/ca-prod-fsbo-ads/images/25/25f13362-5104-493d-9fcd-c8c5d0a673fe?rule=kijijica-200-jpg	2 Bedroom Basement Apartment for Rent	11-09-2022	2022-09-11	Scarborough	Beds: 2	2 Bedroom spacious and bright basement apartment available for rent. Separate Entrance. Laundry included. Close to centennial college and UTSC. Preferred female students. Includes hydro.	1,900.00	$
1632633965	No photo	1 bed room new condo 15 Holmes Ave North York Finch & Young	11-09-2022	2022-09-11	Toronto	Beds: 1	new condo, includes everything, close to Finch & Young Subway	2,300.00	$
1615371983	https://media.kijiji.ca/api/v1/ca-prod-dealer-ads/images/30/306eaec5-e5f0-4d27-a576-9fff22f15362?rule=kijijica-200-jpg	BUY A HOUSE WITH OUR *EXCLUSIVE* $0 DOWN OR RENT-TO-OWN PROGRAM	11-09-2022	2022-09-11	Toronto	Beds: 4	***Buy Any house with our exclusive Zero Down/Rent-To-Own Programs or 5%/10% down payment based on your qualifications (Need to be working Permanent full-time) (Credit has to be 650+) ONLY 15 SPOTS ...	Please Contact	No currency provided
1607392572	https://media.kijiji.ca/api/v1/ca-prod-dealer-ads/images/60/605d6c82-edf9-46c7-8fa5-2e164fdc2a85?rule=kijijica-200-jpg	Bathurst/Eglinton - Renovated 2 Bedroom - $2,195.00	11-09-2022	2022-09-11	Toronto	Beds: 2	Upper Floor Of Duplex, 2 Bedrooms, Updated Kitchen and Bathroom, New Broadloom, Freshly Painted, New Stainless Steel Appliances, Pot Lights, Garage Included. Available Nov 1, Asking $2,195 Listed By ...	2,195.00	$
1632633673	https://media.kijiji.ca/api/v1/ca-prod-fsbo-ads/images/33/33f89089-3541-40c0-a739-cc203735ae8b?rule=kijijica-200-jpg	2 Bedroom condo rental Fairview 401/404	11-09-2022	2022-09-11	Toronto	Beds: 1 + Den	Luxury 1 + 1 (Den Can Be Used As 2nd Bedroom) Condo. Walk to Subway, 1 Parking Included. App Requirement: No pet, non-smoker, first and last, proof of income, credit check and reference.	2,350.00	$
1632633254	https://media.kijiji.ca/api/v1/ca-prod-fsbo-ads/images/a7/a7689fe7-05f2-4e4d-8236-eed4073e8e5a?rule=kijijica-200-jpg	4Bed2Bath North York Bungalow	11-09-2022	2022-09-11	Toronto	Beds: 4	4 Bedroom 2 Bath Bungalow On A Quiet Cu-De-Sac. AAA Tenant(s) Only. Preferably a Single Family. Easy Access to Public Transit, School, School Bus. Not furnished but could be with rent adjustment. ...	3,500.00	$
1568954847	https://media.kijiji.ca/api/v1/ca-prod-dealer-ads/images/c4/c4c45d4a-b3ea-49db-8370-5e86f02b108c?rule=kijijica-200-jpg	Scarborough 1 Bedroom Apartment for Rent - 45 Greenbrae Circuit	11-09-2022	2022-09-11	Scarborough	Beds: 1	Current Promotions View our units by clicking the virtual tour link, schedule a video tour or make an appointment for in person viewing. (416) 439-2567Virtual Open House: View our units by clicking ...	1,935.00	$
1568954894	https://media.kijiji.ca/api/v1/ca-prod-dealer-ads/images/c8/c8ede1b6-ddd7-4d90-a1fd-7ed43276fc68?rule=kijijica-200-jpg	Etobicoke 2 Bedroom Apartment for Rent - 40 Stevenson Road	11-09-2022	2022-09-11	Etobicoke	Beds: 2	Current Promotions View our units by clicking the virtual tour link, schedule a video tour or make an appointment for in person viewing. (437) 237-8128Virtual Open House: View our units by clicking ...	2,449.00	$
1606607669	https://media.kijiji.ca/api/v1/ca-prod-dealer-ads/images/b9/b952ce18-53fc-4464-9174-a4572893dbc7?rule=kijijica-200-jpg	Etobicoke 1 Bedroom Apartment for Rent - 40 Stevenson Road	11-09-2022	2022-09-11	Etobicoke	Beds: 1	Current Promotions View our units by clicking the virtual tour link, schedule a video tour or make an appointment for in person viewing. (437) 237-8128Virtual Open House: View our units by clicking ...	2,149.00	$
1631223372	https://media.kijiji.ca/api/v1/ca-prod-dealer-ads/images/02/02d7065f-7b8d-4139-8da7-2ae66fce2b8d?rule=kijijica-200-jpg	1 Bedroom Apartments for Rent on Jackes Avenue	11-09-2022	2022-09-11	Toronto	Beds: 1	Join Us for Our In-person Open House Every Wednesday and Friday from 4pm to 6pm By appointment only. Call Now to Reserve Your Spot! The Summerhilll at 7 Jackes Avenue is an amazing luxury residence ... Ask About our Rental Incentive!	2,550.00	$
1632118887	https://media.kijiji.ca/api/v1/ca-prod-dealer-ads/images/89/897fbfe7-a882-4123-b6fd-81e14e4326d2?rule=kijijica-200-jpg	Renovated Bachelor at Davisville Village	07-09-2022	2022-09-07	City of Toronto	Beds: Bachelor/Studio	The Davisville Village Community is a popular neighbourhood located close to the Davisville subway station. The neighbourhood has excellent recreational facilities, schools, shopping, restaurants, ... 225 Davisville Avenue	2,000.00	$
1631150828	https://media.kijiji.ca/api/v1/ca-prod-dealer-ads/images/fb/fbb2657c-7ad4-4428-b489-9f6006363f40?rule=kijijica-200-jpg	One Bedroom Suites  | Minto Yorkville for Rent	31-08-2022	2022-08-31	City of Toronto	Beds: 1	Utilities Included Heat Water Building Features Covered parking Elevators Social room Sauna Fitness room Wheelchair access Recreation room Public transit Shopping nearby Parks nearby Schools nearby ... Premium suites at Bay and Yorkville in Toronto	3,109.00	$
1631151000	https://media.kijiji.ca/api/v1/ca-prod-dealer-ads/images/33/3306e094-f66a-48c7-9f75-e26f9a71a4ef?rule=kijijica-200-jpg	NEW |  Renovated 1 Bedroom Apartment | Call Today!	12-09-2022	2022-09-12	Toronto	Beds: 1	Hurry! Limited Time offer. Move-in on or before October 1st and get 1-month free rent for October on Select suites Hurry! Limited Time offer. Move-in on or before October 1st and get 1-month free ... Incentives, Virtual Tours &amp; Incredible Suites! Call Today.	2,239.00	$
1631245807	https://media.kijiji.ca/api/v1/ca-prod-dealer-ads/images/7c/7c3e5dfc-531b-442b-8156-12858cc3fe7b?rule=kijijica-200-jpg	Eco Luxury 2 Bedrooms in The Junction (Includes utilities)	11-09-2022	2022-09-11	City of Toronto	Beds: 2	Newly constructed (9 years) unique 2 bedrooms 1155 square feet coach house, 11 foot steel truss ceilings. Concrete floor with radiant heat. Custom cabinets and mill work in white oak. Back patio ...	3,460.00	$
1505843006	https://media.kijiji.ca/api/v1/ca-prod-dealer-ads/images/8b/8b58ad02-f7db-48f0-b831-5123b77558d2?rule=kijijica-200-jpg	Yonge & Bloor 1 Bedroom Apartment	29-08-2022	2022-08-29	City of Toronto	Beds: 1	88 Bloor Street East - Bloor-Yonge Residences Location, location, location! Our site has a perfect Walk score of 100! The Yonge/Bloor subway stop is a short indoor walk from our lobby to the ... Yonge and Bloor Living!	1,999.00	$
1544545678	https://media.kijiji.ca/api/v1/ca-prod-dealer-ads/images/aa/aa27866a-1bc6-423e-9cce-e9397060fa30?rule=kijijica-200-jpg	LARGE 2 BEDROOM UNITS -north york @ don mills/york mills	11-09-2022	2022-09-11	City of Toronto	Beds: 2	Graydon Hall is located In the heart of North York. Don Mills is a community that was designated as a heritage site. A quick five-minute walk to schools and huge suites makes 20 Graydon Hall a choice ...	2,300.00	$
1632577380	https://media.kijiji.ca/api/v1/ca-prod-fsbo-ads/images/d7/d78e1141-13c8-4f3c-bc6e-d7d420c03443?rule=kijijica-200-jpg	$3,300 All Incl. NEW 3 Bed + 2 Bath Suite-2nd Floor	11-09-2022	2022-09-11	Toronto	Beds: 3	$3,300 All Incl. NEW 3 Bed + 2 Bath Suite-2nd Floor Address: 68 Westbourne Ave, Toronto ON, M1L 2Y4 NMI: St. Clair Ave. & Victoria Park Ave. Available: December 1st 2022 Clean, brand new unit in a ...	3,300.00	$
1567580215	https://media.kijiji.ca/api/v1/ca-prod-dealer-ads/images/66/66162cce-d45c-44b1-8c89-308e50e75d45?rule=kijijica-200-jpg	Roncesvalles 2 Bedroom Apartment for Rent - 55 Triller Avenue	11-09-2022	2022-09-11	Toronto	Beds: 2	Current Promotions View our units by clicking the virtual tour link, schedule a video tour or make an appointment for in person viewing. (647) 490-0601Virtual Open House: View our units by clicking ...	2,548.00	$
1567580209	https://media.kijiji.ca/api/v1/ca-prod-dealer-ads/images/1e/1e65024e-7035-410d-8fa6-64eb8dd84c12?rule=kijijica-200-jpg	Roncesvalles Bachelor Apartment for Rent - 55 Triller Avenue	11-09-2022	2022-09-11	Toronto	Beds: Bachelor/Studio	Current Promotions View our units by clicking the virtual tour link, schedule a video tour or make an appointment for in person viewing. (647) 490-0601Virtual Open House: View our units by clicking ...	1,644.00	$
1632564105	https://media.kijiji.ca/api/v1/ca-prod-dealer-ads/images/57/57db4ac3-6246-49e7-bed8-22fd8b0f529f?rule=kijijica-200-jpg	Parkdale 1 Bedroom Apartment for Rent - 150 Dowling Avenue	11-09-2022	2022-09-11	Toronto	Beds: 1	Current Promotions Please take a virtual tour of our available units now, or request a video tour. Call: 647-688-3614Virtual Open House: Please take a virtual tour of our available units now, or ...	1,876.00	$
1632576507	https://media.kijiji.ca/api/v1/ca-prod-fsbo-ads/images/62/627e8ec8-cea5-40e8-af1b-0ea4e094a1f8?rule=kijijica-200-jpg	$3,300 all in + 2 parking spots /3 Bedroom+2 Bath 2nd Floor Unit	11-09-2022	2022-09-11	Toronto	Beds: 3	$3,300 All Incl. NEW 3 Bed + 2 Bath Suite-2nd Floor Address: 68 Westbourne Ave, Toronto ON, M1L 2Y4 NMI: St. Clair Ave. & Victoria Park Ave. Available: December 1st 2022 Clean, brand new unit in a ...	3,300.00	$
1625224153	https://media.kijiji.ca/api/v1/ca-prod-dealer-ads/images/de/de235405-44c1-4190-a502-38d0e1d1ebc9?rule=kijijica-200-jpg	Condo is for rent open house Monday Aug 29 between 7 and 8 pm	11-09-2022	2022-09-11	Toronto	Beds: 1 + Den	Water front Condo in downtown toronto is avilable for rent 10 York st is available as of September 1st. South facing unit with lake view Please text for viewing 4165439349 2700 with good credit and ...	2,700.00	$
1505791059	https://media.kijiji.ca/api/v1/ca-prod-dealer-ads/images/22/22d336a1-2bdd-4bdb-be85-ad83c99e7d53?rule=kijijica-200-jpg	Parkdale 1 Bedroom Apartment for Rent - 24 Tyndall Avenue	11-09-2022	2022-09-11	City of Toronto	Beds: 1	Current Promotions View our units by clicking the virtual tour link, schedule a video tour or make an appointment for in person viewing. Call: (416)786-5191Virtual Open House: View our units by ... Beautifully renovated units. Ask about our leasing incentives	2,009.00	$
1596795032	https://media.kijiji.ca/api/v1/ca-prod-dealer-ads/images/c0/c09ae1e8-d76c-44ca-8d20-4996155908c6?rule=kijijica-200-jpg	Scarborough1 Bedroom Apartment for Rent - 35 Greenbrae Circuit	11-09-2022	2022-09-11	Scarborough	Beds: 1	Current Promotions View our units by clicking the virtual tour link, schedule a video tour or make an appointment for in person viewing. (647) 261-9483Virtual Open House: View our units by clicking ...	2,148.00	$
1632341062	https://media.kijiji.ca/api/v1/ca-prod-fsbo-ads/images/ac/ac6e794d-c6f0-4a48-830b-786600f5db0e?rule=kijijica-200-jpg	1+DEN FOR RENT TORONTO LAKE VIEWS	09-09-2022	2022-09-09	City of Toronto	Beds: 1 + Den	1+DEN WITH LAKE VIEWS FOR RENT EMPIRE PHOENIX UNDERGROUND PARKING AND LOCKER INCLUDED PLEASE PREPARE RENTAL APPLICATION INCLUDING CREDIT REPORT JOB LETTER & REFERENCES	2,375.00	$
1631223388	https://media.kijiji.ca/api/v1/ca-prod-dealer-ads/images/b9/b92dda0c-8a82-41e1-b3bd-2e2900228668?rule=kijijica-200-jpg	Bachelor/Room for Rent in Stouffville, Toronto North East Area	11-09-2022	2022-09-11	Whitchurch-Stouffville	Beds: Bachelor/Studio	#C (room rental) 6671 Main St. (Toronto) Whitchurch-Stouffville, ON **Bachelor/Room for Rent in Stouffville, Toronto North East Area, Lower Floor of Bungalow, Room for Lease** Welcome To Unit C, 6671 ... Bachelor/Room for Rent in Stouffville, Toronto North East Area, Lower Floor of Bungalow, Room for Lease	1,100.00	$
1632575101	https://media.kijiji.ca/api/v1/ca-prod-fsbo-ads/images/cb/cb2939b5-0b1e-449f-93bb-410df2b435bc?rule=kijijica-200-jpg	SPACIOUS 1 BEDROOM PLUS DEN FOR RENT (SPADINA AND FORT YORK)	11-09-2022	2022-09-11	Ajax	Beds: 1 + Den	Beautiful one bedroom plus den for rent at Spadina/Fort York. The unit is bright and modern featuring floor to ceiling windows in bedroom with ensuite bathroom. Den is large enough to function as a ...	2,500.00	$
1524684773	https://media.kijiji.ca/api/v1/ca-prod-dealer-ads/images/d0/d0de4153-e9f4-47ba-a9fa-08fef506d0ac?rule=kijijica-200-jpg	Golden Equity Properties at 99 Kennedy road North Apartment	11-09-2022	2022-09-11	City of Toronto	Beds: 1	99 Kennedy road North Apartment Special promotion 1 Month Free!!!* *On select units Bright and Spacious 1, 2 & 3-Bedroom Renovated Units to rent. Close to shopping place just across the road. ...	1,500.00	$
1524684771	https://media.kijiji.ca/api/v1/ca-prod-dealer-ads/images/01/010d2eb3-7fce-40ef-81ef-36cce0858414?rule=kijijica-200-jpg	Golden Equity Property at 51 McMurchy Apartment	11-09-2022	2022-09-11	City of Toronto	Beds: 1	Special Promotion 1 month free!!* *On select units at 51 McMurchy Apartments Beautiful 1, 2 & 3-Bedroom Renovated Units, for rent. Situated in a quiet Residential Area, bright and clean apartment ...	1,500.00	$
1505787048	https://media.kijiji.ca/api/v1/ca-prod-dealer-ads/images/95/95ab7df0-7f47-4841-bfc8-95b3989a6619?rule=kijijica-200-jpg	Special Promotion 1 month free at 1475 King street West	11-09-2022	2022-09-11	City of Toronto	Beds: 2	Special promotion 1 Month Free!!!* *On select units Beautiful heritage 1 and 2-bedroom apartments. 1 bedroom starting at $ 1,500.00 and up 2 bedrooms starting at $ 1,800.00 and up 3 bedrooms starting ...	1,500.00	$
1632574293	No photo	2 Bedroom Apartment for rent October 1	11-09-2022	2022-09-11	Toronto	Beds: 2	Two bedroom apartment available for rent starting October 1, 2022. Located in the stockyard District of Toronto this transit-accessible spacious two bedroom apartment is ideal for working ...	2,500.00	$
1632564107	https://media.kijiji.ca/api/v1/ca-prod-dealer-ads/images/ae/aea7e967-67b4-41ae-baeb-945c6cee49db?rule=kijijica-200-jpg	Downtown 1 Bedroom with AC and Laundry Apartment for Rent - 155	11-09-2022	2022-09-11	Toronto	Beds: 1	Current Promotions View our units by clicking the virtual tour link, schedule a video tour or make an appointment for in person viewing. Call now! (647) 360-5252Virtual Open House: View our units by ...	2,216.00	$
1632135935	https://media.kijiji.ca/api/v1/ca-prod-fsbo-ads/images/60/6057b5a1-2692-468d-ac85-887b3b3da760?rule=kijijica-200-jpg	3 Bedroom House for Rent in Toronto, Available Oct 1.	11-09-2022	2022-09-11	City of Toronto	Beds: 3	3 Nice/Clean bedrooms main floor bungalow for rent available October 1, 2022. Warden/Ellesmere intersection. Quiet community. Fridge/Stove/Washer/Dryer. Convenient location, 5 minutes walking to ...	2,790.00	$
1632573529	https://media.kijiji.ca/api/v1/ca-prod-fsbo-ads/images/73/73c5b786-8d89-4222-9f87-dcddc69d4663?rule=kijijica-200-jpg	1 Bedroom in Prime High Park Area	11-09-2022	2022-09-11	Toronto	Beds: 1	Open concept 1 bedroom basement - bright, clean, and facing a quiet tree-lined street in the Prime High Park area. This apartment is centrally located near many major amenities - shops, cafes, ...	1,350.00	$
1632564299	https://media.kijiji.ca/api/v1/ca-prod-dealer-ads/images/66/66191a3b-f2c4-47f3-ad90-0bb76e35dc20?rule=kijijica-200-jpg	Liberty Village 2 Bedrooms +den Apartment for Rent - 295 Dufferi	11-09-2022	2022-09-11	Toronto	Beds: 3	Current Promotions View our units by clicking the virtual tour link, schedule a video tour or make an appointment for in person viewing. (647) 490-0955Virtual Open House: View our units by clicking ...	2,619.00	$
1632564100	https://media.kijiji.ca/api/v1/ca-prod-dealer-ads/images/e1/e1cdb3a5-caec-460c-96fc-4c0ab3669d5a?rule=kijijica-200-jpg	Downtown Large 1 Bedroom Apartment for Rent - 80 Wellesley Stree	11-09-2022	2022-09-11	Toronto	Beds: 1	Current Promotions View our units by clicking the virtual tour link, schedule a video tour or make an appointment for in person viewing. Call now! (647) 558-2263Virtual Open House: View our units by ... Conveniently located downtown condo-like apartments for rent. Newly renovated. Easy access. TTC, pet friendly	2,278.00	$
1632564112	https://media.kijiji.ca/api/v1/ca-prod-dealer-ads/images/f6/f6dd142e-524a-4a0c-aee7-b8964869f622?rule=kijijica-200-jpg	Scarborough 2 Bed 2 Bath Apartment for Rent - 1350 Danforth Road	11-09-2022	2022-09-11	Scarborough	Beds: 2	Current Promotions View our units by clicking the virtual tour link, schedule a video tour or make an appointment for in person viewing. Open House Incentives! (647) 696-7899Virtual Open House: View ...	2,235.00	$
1632573127	https://media.kijiji.ca/api/v1/ca-prod-fsbo-ads/images/4c/4ce61412-bd9e-4466-8d4e-ba4e1afeb7df?rule=kijijica-200-jpg	Studio Apartment for rent in St. Clair West area	11-09-2022	2022-09-11	Toronto	Beds: Bachelor/Studio	Semi-renovated Studio apartment for rent. The St. Clair / Stockyards neighborhood, Toronto. semi-renovated studio apartment - 1 bathroom - located in basement - available 2022-10-01 for $1800 - ...	1,800.00	$
1632573012	https://media.kijiji.ca/api/v1/ca-prod-fsbo-ads/images/59/59dee48a-d7f3-43da-af12-c09c95549989?rule=kijijica-200-jpg	2 Bedrooms College & Bathurst utilities included	11-09-2022	2022-09-11	Toronto	Beds: 2	Renovated two bedrooms, open concept at College and Bathurst. It is a bright unit with a lot of windows. Central Air Conditioner, Hardwood floor, dishwasher, Quartz countertops. Steps to Little ...	2,500.00	$
1630640518	https://media.kijiji.ca/api/v1/ca-prod-fsbo-ads/images/c2/c237cc16-7fdc-4fe2-b7d5-093bdd7012d0?rule=kijijica-200-jpg	Basement 1 BR + Den for rent $1500.00	11-09-2022	2022-09-11	Markham	Beds: 1 + Den	Basement 1 BR + Den $1500.00 Great basement unit with 1 bedroom plus den for rent. Separate entrance. Located near Brimley and Dennison, Markham. Suitable for 1 or 2 people. Rent includes utilities ...	1,500.00	$
1628720165	https://media.kijiji.ca/api/v1/ca-prod-fsbo-ads/images/c0/c0929a30-4f28-4fdf-9cc2-1d108e700fd0?rule=kijijica-200-jpg	Riverdale basement unit	11-09-2022	2022-09-11	Toronto	Beds: 2	Located in the prime Riverdale area, this main unit has 2 bedrooms and living room. Well kept and clean. Independent unit with separate entrance. Excellent TTC access. Steps to bus stop and close to ...	1,900.00	$
1619865984	https://media.kijiji.ca/api/v1/ca-prod-dealer-ads/images/c9/c9388702-d815-4af6-b77d-2cd416b4000c?rule=kijijica-200-jpg	Scarborough 2 Bedrooms Apartment for Rent - 750 Morningside Aven	11-09-2022	2022-09-11	City of Toronto	Beds: 2	Current Promotions View our units by clicking the virtual tour link, schedule a video tour or make an appointment for in person viewing. Call: (437) 237-8128Virtual Open House: View our units by ...	2,458.00	$
1568954281	https://media.kijiji.ca/api/v1/ca-prod-dealer-ads/images/fa/fa14bcd9-e209-40a5-982b-a9701bdd937e?rule=kijijica-200-jpg	Scarborough 1 Bedroom Apartment for Rent - 75 Silver Springs Bou	11-09-2022	2022-09-11	Scarborough	Beds: 1	Current Promotions View our units by clicking the virtual tour link, schedule a video tour or make an appointment for in person viewing. Call: (437) 800-0669Virtual Open House: View our units by ...	1,900.00	$
1568954216	https://media.kijiji.ca/api/v1/ca-prod-dealer-ads/images/33/33489aeb-0a0c-454c-a55a-c75c68de0c97?rule=kijijica-200-jpg	3 Bedroom Townhouse + Den Apartment for Rent - 87-99 Silver Spri	11-09-2022	2022-09-11	Scarborough	Beds: 3	Current Promotions View our units by clicking the virtual tour link, schedule a video tour or make an appointment for in person viewing. Call: (437) 800-0669Virtual Open House: View our units by ...	2,499.00	$
1620781851	https://media.kijiji.ca/api/v1/ca-prod-dealer-ads/images/a2/a2e09d07-1e7a-407f-ac4f-c537309f5f6a?rule=kijijica-200-jpg	Scarborough 2 Bedroom Apartment for Rent - 25 Cougar Court	11-09-2022	2022-09-11	Scarborough	Beds: 2	Current Promotions View our units by clicking the virtual tour link, schedule a video tour or make an appointment for in person viewing. Call: 647-372-2393Virtual Open House: View our units by ...	2,463.00	$
1618108737	https://media.kijiji.ca/api/v1/ca-prod-dealer-ads/images/15/15ef8af9-41ca-4b0c-9fff-33910943acc2?rule=kijijica-200-jpg	Scarborough 1 Bedroom Apartment for Rent - 750 Morningside Avenu	11-09-2022	2022-09-11	Scarborough	Beds: 1	Current Promotions View our units by clicking the virtual tour link, schedule a video tour or make an appointment for in person viewing. Call: (437) 237-8128Virtual Open House: View our units by ...	1,998.00	$
1632564518	https://media.kijiji.ca/api/v1/ca-prod-dealer-ads/images/ac/ac773a10-cc7e-462a-bc77-1fd754a56a6f?rule=kijijica-200-jpg	1 BED + DEN | 1 BATH - BASEMENT APT FOR RENT - SCARBOROUGH	11-09-2022	2022-09-11	Scarborough	Beds: 1 + Den	1 Bedroom + Den | 1 Bathroom, Upgraded Kitchen, Stainless Steel Appliances, Formica Countertops, Laminate Floors, Ensuite Laundry. OPEN 24/7 - HAVE QUESTIONS? CALL US ANY TIME: 905-385-8150 Note: The ... 66 Bonacres Avenue, Scarborough, Ontario M1C 3B9 Close to Highway 2A, Lawson Road at Highway 2A Overpass Bus Stop, Centennial Road Junior Public School, Morningside Crossing, Malvern Town Centre, Rouge National Urban Park, Port Union Waterfront Park,	1,999.00	$
1632564099	https://media.kijiji.ca/api/v1/ca-prod-dealer-ads/images/77/77e79eb9-4114-4d8c-b1ce-39969829fea5?rule=kijijica-200-jpg	Downtown Jr 1 Bedroom Apartment for Rent - 15 Dundonald Street	11-09-2022	2022-09-11	Toronto	Beds: 1	Current Promotions View our units by clicking the virtual tour link, schedule a video tour or make an appointment for in person viewing. Call: (647) 492-7020Virtual Open House: View our units by ...	2,013.00	$
1625546443	https://media.kijiji.ca/api/v1/ca-prod-fsbo-ads/images/71/7183e470-b27d-46b8-9b08-d0d9f51aa1d8?rule=kijijica-200-jpg	$3750/5br-2400ft2-2.5storey, in the heart of Corso Italia	11-09-2022	2022-09-11	Toronto	Beds: 5+	Available for Oct. 1, 2022 Fantastic, Secluded Street In The Heart Of Corso Italia. Huge 2.5 Storey Semi-Detached W/Incredible South Facing Unobstructed View Of Toronto's Magnificat Skyline. A ...	Please Contact	No currency provided
1632564096	https://media.kijiji.ca/api/v1/ca-prod-dealer-ads/images/75/75d0af91-0809-4db7-8d5b-f4bc2a2e1a4a?rule=kijijica-200-jpg	Parkdale 2 Bedroom Apartment for Rent - 150 Dowling Avenue	11-09-2022	2022-09-11	Toronto	Beds: 2	Current Promotions Please take a virtual tour of our available units now, or request a video tour. Call: 647-688-3614Virtual Open House: Please take a virtual tour of our available units now, or ...	2,242.00	$
1632569434	https://media.kijiji.ca/api/v1/ca-prod-fsbo-ads/images/c4/c4e81cb7-2200-4771-a05d-0c21c5f408ab?rule=kijijica-200-jpg	One Bedroom Condo for Rent	11-09-2022	2022-09-11	North York	Beds: 1	Luxurious Waterfront Condo at Downtown Toronto with a Spectacular View of CN Tower and Lake Ontario! One Bedroom 560 S.F.+Balcony 110 S.F Bright West Side with Gorgeous Lake View. Very Practical ...	2,270.00	$
1632568256	https://media.kijiji.ca/api/v1/ca-prod-fsbo-ads/images/1c/1c7d3444-16fe-4423-b730-1eb9b16438ca?rule=kijijica-200-jpg	Lease entire Detached house : Bed 4 ,WR 3, Parking 6 + Basement	11-09-2022	2022-09-11	Pickering	Beds: 4	AVAILABLE NOW FOR IMMEDIATE MOVE-IN! Lease entire Detached house : 4 Beds , 3 Washrooms, 6 Parking and Basement. I am renting my house, spacious over 3000 sqfeet living space, close to the 401 ...	3,300.00	$
1632567709	https://media.kijiji.ca/api/v1/ca-prod-fsbo-ads/images/98/9834f4cc-b1b6-4a1a-9bf7-86b2064573bf?rule=kijijica-200-jpg	2 Bedroom Bright & Renovated	11-09-2022	2022-09-11	Toronto	Beds: 2	2 Bedroom Bright & Renovated, right in Lake Shore Village West. Walk to restaurants, shops, steps to streetcar and Lake Ontario. Open kitchen concept, laundry on site. AC Heat & Water included. Hydro ...	1,900.00	$
1505781145	https://media.kijiji.ca/api/v1/ca-prod-dealer-ads/images/4c/4c065dbd-8bf2-445e-b97b-ca5bb08e9de7?rule=kijijica-200-jpg	Kingsway Village Square - One Bedroom +Den Apartment for Rent	11-09-2022	2022-09-11	Toronto	Beds: 1	Starting at $2400 Building Overivew Kingsway Village Square - 571 Prince Edward Drive North, Toronto Dunpar Homes Offering: 1 Month FREE for a Limited Time Only! Luxury, Location & Convenience. ... Brand New Luxury Condos Coming Up!	2,550.00	$
1568953096	https://media.kijiji.ca/api/v1/ca-prod-dealer-ads/images/b7/b7126cc8-85de-4dbf-8596-6718c5773689?rule=kijijica-200-jpg	Glen Park Apartments - One Bedroom Apartment for Rent	11-09-2022	2022-09-11	Thornhill	Beds: 1	GLEN PARK Flexible Terms Available! Conveniently located, steps away from hundreds of stores on Yonge Street, and easy access to transit. Glen Park is a well-maintained property with its beautiful ... Apartments For Rent in Thornhill, ON | DMS Property Management	2,220.00	$
1632655206	https://media.kijiji.ca/api/v1/ca-prod-fsbo-ads/images/21/21909066-a99e-4f14-9a05-1837f06b3bdf?rule=kijijica-200-jpg	Luxury Fully Furnished Apartment in Central Toronto	12-09-2022	2022-09-12	Toronto	Beds: 1	Large, upscale fully furnished apartment with 5 appliances, in the Keele/Eglinton area. It includes separate bedroom, living room, eat-in kitchen. It comes complete with dishware, cutlery, microwave, ...	1,600.00	$
1632176547	https://media.kijiji.ca/api/v1/ca-prod-dealer-ads/images/0f/0f8fbfcd-083b-4379-9adc-e37871ff419f?rule=kijijica-200-jpg	NOW PRELEASING - 2 BEDROOMS - The Residences At The Well	11-09-2022	2022-09-11	Toronto	Beds: 2	Rent today and receive a one year membership to CLIO Social Club* Renting One, One+Den, Two, Two+Den and Three Bedroom Suites - Move in Starting February, 2023. Size range for 2 Bedrooms are 766-1150 ...	3,795.00	$
1631944681	https://media.kijiji.ca/api/v1/ca-prod-dealer-ads/images/5c/5c21cee2-9456-43df-9d64-78993d47cfcf?rule=kijijica-200-jpg	Renovated Two-bedroom apartment, The Beaches - ID 2338	06-09-2022	2022-09-06	City of Toronto	Beds: 2	Renovated Akelius two bedroom apartment for rent. Queen & Victoria Park in the Scarborough neighborhood, Toronto. renovated two bedroom ground floor - 1 bathroom - approximately 751 square feet - ...	2,350.00	$
1632565681	https://media.kijiji.ca/api/v1/ca-prod-fsbo-ads/images/32/32794c6d-d0b3-4494-9c0c-dfacfb8cabfa?rule=kijijica-200-jpg	Fully Furnished Big 1Br Condo w/Internet, W/D, TV-Cable & Locker	11-09-2022	2022-09-11	Toronto	Beds: 1	Fully Furnished 1Br Condo with Locker is available for rent from October 31, 2022. The building is an award winning Tridel construction at 35 Viking Lane, Toronto, ON and is adjacent to the Kipling ...	2,399.00	$
1632559104	https://media.kijiji.ca/api/v1/ca-prod-fsbo-ads/images/ce/ce6d5cd4-cb0d-4670-837e-fd0e68af09da?rule=kijijica-200-jpg	Newly Built 3-Bedroom Townhouse in North York	11-09-2022	2022-09-11	Toronto	Beds: 3 + Den	Brand new 3 bedroom townhouse located along Lawrence Avenue West, North York. Minutes away from Highway 401, TTC subway station, shopping plaza and schools, this property is perfect for single ...	3,700.00	$
1505843039	https://media.kijiji.ca/api/v1/ca-prod-dealer-ads/images/7f/7ff066db-2c40-4192-90dd-e5977808943e?rule=kijijica-200-jpg	Yonge & Bloor -  Spacious Bachelor	29-08-2022	2022-08-29	City of Toronto	Beds: Bachelor/Studio	Book your tour today, call 416-922-9155 Bloor-Yonge Residences -88 Bloor St East - Direct inside access to TTC Walk score 100 ! Live in the heart of Downtown Toronto Bachelor, Studio Apartments ... Yonge and Bloor Living!	1,855.00	$
1631944758	https://media.kijiji.ca/api/v1/ca-prod-dealer-ads/images/65/65aee9db-d879-4185-ac87-a0023e181930?rule=kijijica-200-jpg	Renovated two bedroom, Eglinton and Bayview - ID 548	06-09-2022	2022-09-06	City of Toronto	Beds: 2	Renovated Akelius two bedroom apartment for rent. Eglinton & Bayview in the Midtown neighborhood, Toronto. renovated two bedroom suite - 2 bathrooms - located on floor 1 - approximately 838 square ...	2,499.00	$
1630928595	https://media.kijiji.ca/api/v1/ca-prod-fsbo-ads/images/2f/2fbd32bf-8f25-4b2c-a493-887753cf35fe?rule=kijijica-200-jpg	3 BR, 2 BATHS apartment at  Finch/Warden for rent-All Included	29-08-2022	2022-08-29	City of Toronto	Beds: 3	Spacious 1,400 sq. ft., 3-bedroom, 2 full washroom apartment is located at Finch and Warden in a very peaceful community. The place is available from October 3rd,2022. The master bedroom has a full ...	2,950.00	$
1623711679	https://media.kijiji.ca/api/v1/ca-prod-fsbo-ads/images/a6/a6284c11-81c4-4501-b7c1-6048959274d5?rule=kijijica-200-jpg	Waterfront Luxury Executive Suite	04-09-2022	2022-09-04	City of Toronto	Beds: 1	About the Suite: Enjoy this luxury fully upgraded modern suite, fully furnished. Amazingly designed with an open concept of a cozy and warm feel. Amenities: Incredible amenities including saltwater ...	4,500.00	$
1632654876	https://media.kijiji.ca/api/v1/ca-prod-fsbo-ads/images/c8/c8680e81-911c-45d8-a1de-51c5b540f473?rule=kijijica-200-jpg	Petite 1 bedroom apt steps to keelesdale subway station	12-09-2022	2022-09-12	City of Toronto	Beds: 1	Located in the Keelesdale neighbourhood, this is a boutique, 6 unit Toronto apartment building. Ideal for a single or professional working couple. Apts include two separate entrances front and back. ...	1,800.00	$
1632654519	No photo	Eglinton at Bathurst.	12-09-2022	2022-09-12	Toronto	Beds: 2	Very large 2 bedroom apartment on 2 floors above a storefront on Eglinton one light west of Bathurst. Please TEXT only 416 518 4830.	2,200.00	$
1505825496	https://media.kijiji.ca/api/v1/ca-prod-dealer-ads/images/7c/7c23f45f-2161-4aeb-ab9f-c7a38ee0dfa3?rule=kijijica-200-jpg	Upgraded 1 Bedroom Apartment Near Bay and Bloor	12-09-2022	2022-09-12	City of Toronto	Beds: 1	Live in the Heart of Downtown Toronto at Bay & Bloor! 1101 Bay boasts of the best price-to-quality ratio of any apartment in the area and resides one block south of the corner of Bay and Bloor - one ... Oxford Residential - 1101 Bay - Live in downtown Toronto with convenient access to everything!	2,295.00	$
1505825513	https://media.kijiji.ca/api/v1/ca-prod-dealer-ads/images/25/25fd7521-d231-4603-85a1-1fa71432e044?rule=kijijica-200-jpg	Beautiful Furnished Studio in the Core of Downtown Toronto	12-09-2022	2022-09-12	City of Toronto	Beds: Bachelor/Studio	Live in the Heart of Downtown Toronto at Bay & Bloor! Our team has been recognized as a Superhost onsites like Airbnb due to ourresponsiveness, reliability, and outstanding hospitality! Rent with ... Oxford Residential - 1101 Bay - Live in downtown Toronto with convenient access to everything!	2,295.00	$
1505825504	https://media.kijiji.ca/api/v1/ca-prod-dealer-ads/images/e3/e30134bb-656d-4dab-a14f-0dcf9ef8105e?rule=kijijica-200-jpg	Prime Downtown Location! Bachelor Apartment near Bay and Bloor	12-09-2022	2022-09-12	City of Toronto	Beds: Bachelor/Studio	Live in the Heart of Downtown Toronto at Bay & Bloor! 1101 Bay has a selection of Bachelor, 1 Bedroom and 2 Bedroom apartments for rent. Rentals Available Now! 1101 Bay boasts of the best ... Oxford Residential - 1101 Bay - Live in downtown Toronto with convenient access to everything!	1,995.00	$
1505825508	https://media.kijiji.ca/api/v1/ca-prod-dealer-ads/images/c3/c3258d67-4fe0-4c2b-b272-f6f2485c9d80?rule=kijijica-200-jpg	2 Bedroom at Bay and Bloor in Toronto's Downtown Core	12-09-2022	2022-09-12	City of Toronto	Beds: 2	The residential property of 1101 Bay boasts of the best price-to-quality ratio of any apartment in the area and resides one block south of the corner of Bay and Bloor - one of the most desirable ... Oxford Residential - 1101 Bay - Live in downtown Toronto with convenient access to everything!	2,895.00	$
1632654142	https://media.kijiji.ca/api/v1/ca-prod-fsbo-ads/images/43/43d68738-f2f6-4086-ac87-0fbffea11092?rule=kijijica-200-jpg	With views like this, you won't need a TV!	12-09-2022	2022-09-12	Toronto	Beds: 1 + Den	* Utilities & Internet Included! * Large 1 Bedroom + Den. * Parking spot w/ Electric Charge Station. * Parking attached 100sq/ft storage room. * Views of CN Tower and downtown core. * Steps from ...	2,950.00	$
1632653759	No photo	Bloor and Bathurst	12-09-2022	2022-09-12	Toronto	Beds: 2	Very large 2 bedroom apartment above a storefront on the third floor. Ideally set up for live/work space. 1,400 sq. ft. Located above El Furniture Warehouse on Bloor St. West. Please TEXT only 416 ...	2,600.00	$
1627966389	https://media.kijiji.ca/api/v1/ca-prod-dealer-ads/images/eb/eba7cca7-fd26-4b86-b85c-87eeb3808714?rule=kijijica-200-jpg	Scarborough 2 Bedroom Apartment for Rent - 4 Treewood Street	12-09-2022	2022-09-12	Scarborough	Beds: 2	Current Promotions View our units by clicking the virtual tour link, schedule a video tour or make an appointment for in person viewing.Virtual Open House: View our units by clicking the virtual tour ...	2,393.00	$
1632245208	https://media.kijiji.ca/api/v1/ca-prod-dealer-ads/images/34/347894d6-7bf3-48e2-a13a-467c4be3bf90?rule=kijijica-200-jpg	Upscale 1 Bedroom Suite Don Mills & Sheppard Ave E	12-09-2022	2022-09-12	Toronto	Beds: 1	Our renovated apartments at 25 Leith Hill are conveniently located at Leith Hill Rd, near Don Mills Rd in Toronto's North York region. Please contact Lola at (416) 494-0521 to schedule a viewing. The ...	1,899.00	$
1632556830	https://media.kijiji.ca/api/v1/ca-prod-fsbo-ads/images/2e/2e1d6ccb-3495-4c69-8dba-a310526fe67d?rule=kijijica-200-jpg	Furnished 1 BR Condo - Downtown Toronto - Oct 17	11-09-2022	2022-09-11	Toronto	Beds: 1	Lease terms: Start date: Oct 17th,2022 Home Showing: Oct 15-16th,2022 The furnished pics will be updated after Oct 14. Welcome To Yonge + Rich — 25 Richmond St E. 1 years new. 1 Bedroom & full ...	2,400.00	$
1618391411	https://media.kijiji.ca/api/v1/ca-prod-dealer-ads/images/df/df8166bf-463a-46c6-ac45-ece4d93fcba6?rule=kijijica-200-jpg	2 Bedroom Apartment for Rent Steps to Victoria Park Station!	21-08-2022	2022-08-21	City of Toronto	Beds: 2	Touch free leasing: Virtual viewings via video conferencing and online leasing available. Book yours today. Our Rental Office remains operational in light of COVID-19. The health and safety of you, ... Proudly Managed by Realstar Management! Cambridge Place Apartments Offers Bachelor, 1, 1-Bedroom Large, 2 and 3-Bedroom Suites! Office Open Daily!	2,475.00	$
1630010860	https://media.kijiji.ca/api/v1/ca-prod-dealer-ads/images/59/5911312d-2493-41be-bb34-6ead9bfec379?rule=kijijica-200-jpg	1BR & 2BR Brand new Condo units at Parliament & Richmond St !!	06-09-2022	2022-09-06	City of Toronto	Beds: 2 + Den	Looking for a couple/working professionals to lease brand new Condo units at Parliament & Richmond St available immediately !! Steps to Distillery District, Loblaws, Dundas TTC Subway, Bars/Restos, ... Leasing Condos all over GTA!! Studio, 1 Bedroom, 1+Den, 2 bedroom, 3 Bedroom....CALL NOW!!	2,500.00	$
1619544227	https://media.kijiji.ca/api/v1/ca-prod-dealer-ads/images/d2/d2c71fec-71ba-40b2-890f-2b7bf5ccfbcf?rule=kijijica-200-jpg	2BR Brand new Condo units w/Parking at St Clair & Keele St	06-09-2022	2022-09-06	City of Toronto	Beds: 2 + Den	Looking for a couple/working professional to lease brand new Condo units at St. Clair Ave & Keele available immediately !! Steps to Loblaws, Walmart, LCBO, Runnymede TTC Station, The Junction, ... Leasing Condos all over GTA!! Studio, 1 Bedroom, 1+Den, 2 bedroom, 3 Bedroom....CALL NOW!!	2,900.00	$
1632606763	https://media.kijiji.ca/api/v1/ca-prod-fsbo-ads/images/84/84f3e108-a1ca-4c8d-94d1-dc5a927875fd?rule=kijijica-200-jpg	One plus den, steps to Finch subway	11-09-2022	2022-09-11	Toronto	Beds: 1 + Den	1+1 In Yonge/Finch. Den Used As 2nd Bdr	2,500.00	$
1632606389	https://media.kijiji.ca/api/v1/ca-prod-fsbo-ads/images/8e/8e80bf0f-b3da-4276-8732-d04bcd34a1b7?rule=kijijica-200-jpg	WISH CONDOS  for Rent - One Bedroom plus Den - $2350	11-09-2022	2022-09-11	Toronto	Beds: 1 + Den	Newly built Wish Condos! One Bed + Den offers A Functional Layout in An Excellent Location, Parking Included. Features 9Ft Ceilings, Laminate Floors, Ensuite Laundry, Walk-In Closet And Easy Access ...	2,350.00	$
1632605382	https://media.kijiji.ca/api/v1/ca-prod-fsbo-ads/images/aa/aa52f0cf-8db0-4576-a0c6-d7e64dbd1d90?rule=kijijica-200-jpg	One bedroom, all included, steps to Finch subway	11-09-2022	2022-09-11	Toronto	Beds: 1	Spacious 1 Bedroom Located In Yonge & Finch Area.	2,350.00	$
1632605001	https://media.kijiji.ca/api/v1/ca-prod-fsbo-ads/images/b4/b49c2ccc-9cf4-4c2e-b6a9-38155460edef?rule=kijijica-200-jpg	House for Rent	11-09-2022	2022-09-11	Toronto	Beds: 3	Prime Scarborough Location. Gorgeous Two Story 3 Bedrooms Semi Detached House for Rent On Very Quiet Court Near Rouge Beach. West Rough Area At Port Union Rd./Lawrence Ave. E. Area. Walking Distance ...	3,150.00	$
1632602979	https://media.kijiji.ca/api/v1/ca-prod-fsbo-ads/images/b1/b14060a6-5f78-46f3-be97-95c4f677d299?rule=kijijica-200-jpg	BRIGHT Renovated 2 br $1800.00	11-09-2022	2022-09-11	Toronto	Beds: 2	Bathurst Sheppard basement apartment with modern kitchen (quartz countertop), new floors, spacious closets, laundry, internet and parking for one car. Tenant pays 1/3 of hydro. Large garden and one ...	1,800.00	$
1632603973	https://media.kijiji.ca/api/v1/ca-prod-fsbo-ads/images/f8/f877db63-c401-4c42-9909-6823db165bae?rule=kijijica-200-jpg	3 bed 1 bath basement Apt. near Kingston Rd/St.Clair Ave E Oct 1	11-09-2022	2022-09-11	Scarborough	Beds: 3	Moderately Furnished 3 bedroom basement available OCT 01, 2022, Kingston Rd/St.Clair Ave E This house is in a quiet neighborhood, has 3 bedrooms (one big room - can accommodate 2 individuals, two ...	2,100.00	$
1632603816	No photo	BASEMET FOR RENT IN SCARBOROUGH	11-09-2022	2022-09-11	Toronto	Beds: 2	Amazing Location! Very Bright Home, Conveniently Located Near Highway 401, Fully Renovated Detach Bungalow basement with 2 Bedrooms and 1 Full-Washroom. Separate laundry for basement tenants. Hydro ...	Please Contact	No currency provided
1632603508	https://media.kijiji.ca/api/v1/ca-prod-fsbo-ads/images/c3/c3411974-1903-4ac4-b2ba-78860710ce92?rule=kijijica-200-jpg	Available NOW: Distillery 2bdr/2bth at 21 Lawren Harris Square	11-09-2022	2022-09-11	Toronto	Beds: 2	Distillery District 700 Sq Ft. The Best Layout In The Building. The Only Exposure With Privacy And Ambience Of Unobstructed View. Den Can Double As A Bedroom, Or Office Space Or Extend Your Living ...	3,000.00	$
1632603289	https://media.kijiji.ca/api/v1/ca-prod-dealer-ads/images/aa/aacbbc85-10b6-4505-a696-3fca429639ba?rule=kijijica-200-jpg	2 BEDROOMS BASEMENT APARTMENT FOR RENT	11-09-2022	2022-09-11	Toronto	Beds: 2 + Den	Hi we have 2 Bedrooms and den brand new renovated basement apartment for rent available for rent in Scarborough close to morningside ave and Neilson road in Scarborough, Basement has separate ...	1,750.00	$
1632602079	No photo	MAIN FLOOR FOR RENT IN SCARBOROUGH	11-09-2022	2022-09-11	Toronto	Beds: 3	Amazing Location! Very Bright Home, Conveniently Located Near Highway 401, Fully Renovated Detach Bungalow with 3 Bedrooms, with living / dining and 1 Full-Washroom. Separate laundry for main floor ...	Please Contact	No currency provided
1547009615	https://media.kijiji.ca/api/v1/ca-prod-dealer-ads/images/75/75b2f3fe-ade5-4c3d-a3a0-44a06999660a?rule=kijijica-200-jpg	Upscale Large 1 Bedroom Suite Yonge and St Clair-Air Conditioned	11-09-2022	2022-09-11	Toronto	Beds: 1	Prime Yonge & St. Clair Address! Check Out Our Website! www.commonwealthtowers.ca CALL , TEXT OR EMAIL TODAY TO BOOK A VIEWING! 416-825-8894 rentyph@outlook.com Upscale Rental Living at The ...	2,199.00	$
1631150891	https://media.kijiji.ca/api/v1/ca-prod-dealer-ads/images/d9/d9d56fc9-6a5f-47fc-bd74-e5afcfbd9a65?rule=kijijica-200-jpg	PROMO! 1 Bedroom Apartment - | SAVE $3,200 - 7,000 Call now	11-09-2022	2022-09-11	Toronto	Beds: 1	Hurry! Limited Time offer. Move-in on or before October 1st and get 1-month free rent for October on Select suites Hurry! Limited Time offer. Move-in on or before October 1st and get 1-month free ... FLASH SALE | Incredible Incentives, Virtual Tours &amp; Incredible Suites! Call Today!	1,979.00	$
1631150870	https://media.kijiji.ca/api/v1/ca-prod-dealer-ads/images/e2/e2dfc515-5306-4f37-a9c5-67e9114d9a11?rule=kijijica-200-jpg	PROMOTION  | Bachelor Suite - Newly Renovated | Call today!	11-09-2022	2022-09-11	Toronto	Beds: Bachelor/Studio	Hurry! Limited Time offer. Move-in on or before October 1st and get 1-month free rent for October on Select suites Hurry! Limited Time offer. Move-in on or before October 1st and get 1-month free ... Incentives, Virtual Tours &amp; Incredible Suites! Call Today.	2,009.00	$
1632601519	https://media.kijiji.ca/api/v1/ca-prod-fsbo-ads/images/8c/8c9461b4-5713-4aef-b9f6-b2ec31353b76?rule=kijijica-200-jpg	Sep24/Downtown Toronto Cityplace/ 1br+1den + parking + utilities	11-09-2022	2022-09-11	City of Toronto	Beds: 1 + Den	Sep24/Downtown Toronto Cityplace/ 1br+1den + parking + utilities Downtown Toronto living at cityplace. Please see the virtual tour here. https://youtu.be/9YuLtqRgjMQ	2,600.00	$
